_ID_,_MAIN_CATEGORY_,_MANUFACTURER_,_NAME_,_DESCRIPTION_,_PRICE_,_IMAGE_
21214,Системы видеонаблюдения|Видеонаблюдение|Камеры видеонаблюдения,KT&C,KT&C; ACE-WDR38CV5,"KT&C; ACE-WDR38CV5 модульное видеооборудование цветного исполнения, созданное корейской фирмой KT&C.; Прибор поставляется в комплекте с вариофокальным объективом, фокусное расстояние которого находится в рамках от 3,8 мм до 9,5 мм.",0,img/21214.jpg
21215,Системы видеонаблюдения|Видеонаблюдение|Камеры видеонаблюдения,KT&C,KT&C; ACE-M381PHB,"KT&C; ACE-M381PHB цветная миниатюрная видеокамера, чувствительностью 0,05лк, разрешением 550ТВЛ и наличием функции ATW. Миниатюрные видеокамеры, используются для видеонаблюдения. Камеры видеонаблюдения предназначенны для построения качественной, системы видеонаблюдения, или для дополнение существующей, системы безопасности.",0,img/21215.jpg
21216,Системы видеонаблюдения|Видеонаблюдение|Камеры видеонаблюдения,KT&C,KT&C; ACE-M381PHP1,"KT&C; ACE-M381PHP1  компактная и миниатюрная цветная видеокамера, закрепленная на интегральной микросхеме-матрице Sony 1/3"" из группы приборов с зарядовой связью (ПЗС). Количество вертикальных ТВ линий - не ниже 520, что говорит о высокой разрешающей способности модели, влияющей на качество картинки, передаваемой на главную панель управления слежения.",0,img/21216.jpg
21217,Системы видеонаблюдения|Видеонаблюдение|Камеры видеонаблюдения,KT&C,KT&C; ACE-M381PHP4,"KT&C; ACE-M381PHP4 цветная модульная видеокамера,  малогабаритный видеоэлемент, включающий в себя установленный на цветном фотодиодном модуле стандартный конусный объектив фиксированного типа с характеристиками функций, позволяющими использовать видеокамеру для профессиональных систем круглосуточного слежения.
",0,img/21217.jpg
21218,Системы видеонаблюдения|Видеонаблюдение|Камеры видеонаблюдения,KT&C,KT&C; ACE-M381PHCMAI,"KT&C; ACE-M381PHCMAI цветная, модульная, без объектива матрица SONY 1/3"" Super HAD, разрешение 520 ТВЛ, минимальная освещенность 0,5 Лк, отношение сигнал/шум 50 дБ, электронный затвор 1/50-1/100.000 к/с, крепление C/CS, напряжение питания 12В, рабочая температура -10°...+50°С.Камера видеонаблюдения  предназначена для установки в кожух.",0,img/21218.jpg
21219,Системы видеонаблюдения|Видеонаблюдение|Камеры видеонаблюдения,KT&C,KT&C; ACE-S200CB (3.6),"KT&C; ACE-S200CB (3.6)  цветная, модульная, матрица SONY 1/4″ Super HAD CCD, разрешение 380 ТВЛ, минимальная освещенность 0,5 Лк, отношение сигнал/шум 45 дБ, электронный затвор 1/50-1/100.000 к/с, автоматическая регулировка усиления (AGC), компенсация встречной засветки (BLC), автоматический баланс белого (AWB), фокусное расстояние на выбор f=3,6/6/8/12 мм, напряжение питания 12В ± 10%, рабочая температура -10°...+45°С.",0,img/21219.jpg
21220,Системы видеонаблюдения|Видеонаблюдение|Камеры видеонаблюдения,KT&C,KT&C; ACE-S200B(2.97),"KT&C; ACE-S200B(2.97)  цветная, модульная видеокамера, матрица SONY 1/4″ Super HAD CCD, разрешение 380 ТВЛ, минимальная освещенность 0,5 Лк, отношение сигнал/шум 45 дБ, электронный затвор 1/50-1/100.000 к/с, автоматическая регулировка усиления (AGC), компенсация встречной засветки (BLC), автоматический баланс белого (AWB),фокусное расстояние	2.97 мм , напряжение питания 12В ± 10%, рабочая температура -10°...+45°С.,габаритные размеры 32x32 мм.",0,img/21220.jpg
21221,Системы видеонаблюдения|Видеонаблюдение|Камеры видеонаблюдения,KT&C,KT&C; ACE-EX300CB,"KT&C; ACE-EX300CB цветная модульная видеокамера, используемая как видеоустройство слежения, величиной 32х32 мм. Малые габариты видеоустройства подходят для компоновки в оборудование, требующее ограничения размера видеоприборов слежения.В комплект камеры  входит базовая микросхема Sony 1/3 дюйма категории Super HAD CCD на печатной плате с закрепленным объективом по выбору заказчика и фокусом от 3,6 до 12 миллиметров.",0,img/21221.jpg
21222,Системы видеонаблюдения|Видеонаблюдение|Камеры видеонаблюдения,KT&C,KT&C; ACE-EX300CР1,"KT&C; ACE-EX300CР1 модульная цветная видеокамера станет самым эффективным инструментом для организации профессиональной системы видеонаблюдения. Модель имеет малые габариты 32х32 миллиметра, что делает ее применение обоснованным для скрытых систем видеонаблюдения.Она успешно работает при температурах от -10 до +45 градусов Цельсия. Видеокамера   имеет матрицу SONY 1/3"" SUPER HAD CCD, максимальная разрешающая способность равна 380 ТВЛ.",0,img/21222.jpg
21223,Системы видеонаблюдения|Видеонаблюдение|Камеры видеонаблюдения,KT&C,KT&C; ACE-EX300CP4,"KT&C; ACE-EX300CP4 цветная модульная видеокамера - аналоговое видеоустройство слежения, которое монтируют внутри аппаратов и приборов в местах общественного пользования, требующих постоянного профессионального контроля. В комплект модели входит цветной сенсор Sony 1/3 инч типа Super HAD CCD на печатной плате с закрепленным оптическим объективом, фиксированный фокус которого равен 4,3 мм.",0,img/21223.jpg
21224,Системы видеонаблюдения|Видеонаблюдение|Камеры видеонаблюдения,KT&C,KT&C; ACE-S300B,"KT&C; ACE-S300B цветная модульная камера видеонаблюдения, матрица SONY 1/4″ Super HAD CCD, разрешение 380 ТВЛ, минимальная освещенность 0,5 Лк, отношение сигнал/шум 45 дБ, электронный затвор 1/50-1/100.000 к/с, автоматическая регулировка усиления (AGC), компенсация встречной засветки (BLC), автоматический баланс белого (AWB),объектив	""В"" - Board lens: f 2.45/2.97/3.6/4.3/6.0/8.0/12.0 mm , напряжение питания 12В ± 10%, рабочая температура -10°...+45°С.,габаритные размеры 32x32 мм.",0,img/21224.jpg
21225,Системы видеонаблюдения|Видеонаблюдение|Камеры видеонаблюдения,KT&C,KT&C; ACE-S300CB (3.6) NTSC,АНАЛОГ ВЗАМЕН: KT&C; ACE-M321PUB (3.6),0,img/21225.jpg
21226,Системы видеонаблюдения|Видеонаблюдение|Камеры видеонаблюдения,KT&C,KT&C; ACE-S300CP3,"KT&C; ACE-S300CP3  модульная цветная видеокамера, имеющая небольшие размеры и легко монтируемые крепления. Прибор создан без корпуса, это - одно из преимуществ его использования, так как дает возможность помещения модели в системы внутреннего наблюдения (домофоны, двери, банковские платежные аппараты). Можно также подобрать подходящий по размеру и дизайну корпус, соответствующий блок питания, встроить модуль и использовать камеру в качестве прибора внешнего видеонаблюдения.",0,img/21226.jpg
21227,Системы видеонаблюдения|Видеонаблюдение|Камеры видеонаблюдения,KT&C,KT&C; ACE-S300CP3 NTSC,"KT&C; ACE-S300CP3 NTSC модульная цветная видеокамера видеонаблюдения. Модель оснащена матрицей SONY 1/3"" Super HAD CCD и имеет разрешение 380ТВЛ. Чувствительность камеры составляет 0.5 Люкс. Модель имеет компактные размеры - 32x32 мм и весит всего 38 грамм. Питание камеры - DC12V.Электронный затвор NTSC: 1/60 ~ 1/100,000sec автоматический.Предназначена для системы видеонаблюдения, охраны и контроля объектов.",0,img/21227.jpg
21228,Системы видеонаблюдения|Видеонаблюдение|Камеры видеонаблюдения,KT&C,KT&C; ACE-S300CP4,"KT&C; ACE-S300CP4 цветная модульная видеокамера ,оснащена объективом с фиксированой диафрагмой.Фокусное растояние объектива может быть 2.45/2.97/3.6/4.3/6/8/12/16mm, что соответсвенно составляет 150/130/92/78/53/40/28/19º. Наличие у объектива ""pinhole"" позволяет осуществить скрытую установку данной видеокамеры.Модель оснащена матрицей SONY 1/3"" Super HAD CCD и имеет разрешение 380ТВЛ. Чувствительность камеры составляет 0.5 Люкс. Модель имеет компактные размеры - 32x32 мм и весит всего 38 грамм. Питание камеры - DC12V.",0,img/21228.jpg
21229,Системы видеонаблюдения|Видеонаблюдение|Камеры видеонаблюдения,KT&C,KT&C; ACE-S110CM,"KT&C; ACE-S110CM цветная, модульная видеокамера, матрица SONY 1/3"" Hi-Res. Super HAD CCD , разрешение 480 ТВЛ, минимальная освещенность 0,5 Лк, отношение сигнал/шум 48 дБ, электронный затвор 1/50-1/100.000 к/с, автоматическая регулировка усиления (AGC), компенсация встречной засветки (BLC), автоматический баланс белого (AWB),объектив	f = 3.6/6/8/12 mm , напряжение питания 12В ± 10%, рабочая температура -10°...+50°С.,габаритные размеры 35x35 мм. ",0,img/21229.jpg
21230,Системы видеонаблюдения|IP-видеонаблюдение|Сетевые IP камеры,AXIS,AXIS M1004-W,"Компания Axis Communications, представляет новую IP-камеру AXIS M1004-W для внутреннего беспроводного видеонаблюдения, где ключевыми факторами являются бюджет и универсальность. Модель поддерживает протокол Wi-Fi Protected Setup, упрощающий процесс настроек конфигурации, обеспечивающей логическую безопасность беспроводных сетей. Это помогает установщикам или сборщикам сэкономить время установки и с легкостью установить высокую степень защиты сети в зоне Wi-Fi, если нет возможности проложить кабель Ethernet. Также сетевая камера поддерживает сервис видеохостинга AXIS Video Hosting System с функцией подключения камеры One-click, что делает камеру идеальной для хостинга видеонаблюдения. Кроме того, имеются порты ввода/вывода (1 ввод и 1 вывод) для подключения устройств, например датчиков и внешних реле, для включения света или открытия/закрытия дверей. Камера поддерживается самым распространенным в промышленности базовым программным обеспечением управления видеоустройствами через программы Axis Application Development Partner Program и AXIS Camera Station. Камера также поддерживает приложения AXIS Camera Application Platform, AXIS Video Hosting System и ONVIF, обеспечивающие простую интеграцию системы камер и позволяющие разработчикам приложений оснащать камеры интеллектуальными функциями.«Камеру M1004-W легко установить и цены на нее привлекательны, что делает общепризнанную серию AXIS M10 более универсальной и разнообразной, – говорит Эрик Франнлид, директор по менеджменту компании Axis. – Камера обеспечивает поддержку нажимной кнопки для легкого подключения WLAN, гарантируя удобство пользования и высокую степень защиты сети в процессе устойчивой и надежной передачи видеоизображения высокого качества по беспроводной сети. Небольшие предприятия и бытовые пользователи получат доступное и простое в использовании решение в области видеонаблюдения».Технические характеристики AXIS M1004-WСтандарт сжатия	H.264 (MPEG-4 Part 10/AVC), Motion JPEG
Скорость (кадров в секунду) PAL	H.264 - 30 кадров в секунду при любом разрешении; Motion JPEG - 30 кадров в секунду при любом разрешении (производительность может быть снижена в беспроводной режим)
Максимальное разрешение (точек на дюйм)	1280x800 (HDTV 720p)
Тип объектива	2.8 мм, F2.0, фиксированная диафрагма, регулируемый фокус
Тип матрицы	1Мп 1/4"" CMOS-сенсор с прогрессивной разверткой
Освещенность (люкс)	1.2 - 10000 люкс, F2.0
Сеть Ethernet	RJ45 10BASE-T/100BASE-TX
Защита	защита паролем, фильтрация IP адресов, HTTPS-шифрование, digest-аутентификация, журнал доступа пользователя, WEP 64/128 bit, WPA/WPA2-PSK
Программное обеспечение в комплекте	Axis Camera Station One, полный мониторинг в реальном времени, 1 канал записи и воспроизведения (не Mac-совместимый)
Встроенный детектор движения	есть
Угол обзора по горизонтали	80 градусов
Монтаж	потолочный, настенный
WEB браузер	Internet Explorer, Safari, Firefox, Хром
Операционная система	Windows (XP или более поздняя версия), Windows Server (2003 или более поздней версии), Mac OSX (10.4.4 или более поздней версии)
Поддерживаемые протоколы	  IPv4/v6, HTTP, HTTPS, QoS Layer 3 DiffServ, FTP, SMTP, Bonjour, UPnP, SNMPv1/v2c/v3(MIB-II и 041;, DNS, DynDNS, NTP, RTSP, RTP, TCP, UDP, IGMP, RTCP, ICMP, DHCP, ARP
Рабочая температура	от 0 C до 40 C
Рабочая влажность	20 - 80% относительной влажности (без конденсации)
Потребляемая мощность	4,9 - 5,1 пост. тока, макс. 6.5 Вт
Размеры	95 x 59 x 41мм
Вес	111 гр
Процессоры и память	ARTPEC-B, 256 Мб RAM, 128 Мб Флэш-памятиДокументация AXIS M1004-WИнструкция пользователя AXIS M1004-W
Руководство по быстрой установке AXIS M1004-WПараметры AXIS M1004-WРазмер матрицы1/4Макс. разрешение, Мпикс1Скорость при макс.разр. кадр/сек30ИК-подсветка-Минимальная светочувствительность, лк1.2Объектив2.8 ммPOE-Питание12VDCРабочая температураОт 0 до +40Класс защиты-Антивандальность-Звук-
 

                ",14672,img/21230.jpg
