_ID_,_MAIN_CATEGORY_,_MANUFACTURER_,_NAME_,_DESCRIPTION_,_PRICE_,_IMAGE_
11068,Системы видеонаблюдения|IP-видеонаблюдение|Сетевые IP камеры,GrandStream,GrandStream GXV3651_FHD,,0,img/11068.jpg
11077,Системы видеонаблюдения|Видеонаблюдение|Камеры видеонаблюдения,Samsung,Samsung SCB-1000P,"F1.2
Функции:день/ночь: авто (электрич.) / вкл
BLC (компенсация встречной засветки): низкий/средний/высокий/выкл
Увеличение чувствительности: 2x - 128х
SSNR (цифровое шумоподавление): низкий/средний/высокий/выкл
Баланс белого: ATW/ручной/ AWC (1800°K - 10500°K)
Скорость электронного затвора: 1/50 – 1/120 000 с
Регулировка усиления: низкий/средний/высокий/выкл
Детектор движения: выкл/вкл (4 зоны)
Защита от вторжения в частную жизнь: выкл/вкл (4 зоны)
Выход видеосигнала: CVBS, 1.0 Vp-p, 75Ω (композитный)
Отношение сигнал/шум: 50дБ
Требования к электропитанию: 12V DC/24V AC
Потребляемая мощность: 3.5 Вт
Масса: 340 г
Размеры (ШхВхГ): 58x52x121 мм
Условия окружающей среды рабочая температура: -10°…+50 °C, отн. влажность в пределах: до 90%",0,img/11077.jpg
11078,Системы видеонаблюдения|Видеонаблюдение|Камеры видеонаблюдения,Samsung,Samsung SCB-2000PH,"Цветная камера видеонаблюдения Samsung SCB-2000PH в корпусе с поддержкой режимов ""день-ночь"". Выполнена на базе ПЗС-матрицы высокого разрешения Sony Super HAD форматом 1/3'', на базе микропроцессора цифровой обработки сигнала последнего поколения Winner W-В. Поддерживаемое разрешение - до 600 ТВЛ, используется детектор движения, передача команд ведется через протоколы RS-485/Coaxitron. Высокая светочувствительность позволяют Samsung SCB-2000PH выдавать качественное изображение даже в непростых условиях.",6516,img/11078.jpg
11079,Системы видеонаблюдения|Видеонаблюдение|Камеры видеонаблюдения,Samsung,Samsung SCB-2001PH,"Корпусная камера видеонаблюдения Samsung SCB-2001PH на базе процессора DSP A1 и CCD-матрицы Sony Super HAD формата 1/3''. Эта цветная камера поддерживает разрешение до 600 ТВЛ, режимы ""день-ночь"" (с электромеханическим переключением), передачу команд по протоколу Coaxitron, имеется аналитический детектор движения, расширенный динамический диапазон, а показатель светочувствительности составляет 0,05/0,0001 Лк в дневном/ночном режиме. По уровню функционала Samsung SCB-2001PH является одним из лучших устройств в своем ценовом сегменте, что делает эту камеру прекрасным вариантом для интеллектуального видеонаблюдения.",7488,img/11079.jpg
11080,Системы видеонаблюдения|Видеонаблюдение|Камеры видеонаблюдения,Samsung,Samsung SCB-3000PH,АНАЛОГ ВЗАМЕН: Samsung SCB-3001PH,0,img/11080.jpg
11081,Системы видеонаблюдения|Видеонаблюдение|Камеры видеонаблюдения,Samsung,Samsung SCB-3001PH,"Процессор цифрового сигнала цветной видеокамеры с функцией день-ночь Samsung SCB-3001PH имеет трехмерную технологию шумоподавления. На экране меню – цифровая стабилизация изображения. 700 черно-белых и 650 цветных телевизионных линий. Обработка изображения производится ПЗС-матрицей удвоенной плотности. Интеллектуальный видео анализ прослеживаемого движения, удаленного объекта. Расширенный динамический диапазон просмотра. Функция «день/ночь» с перемещаемым фильтром. Прогрессивный просмотр позволяет идентифицировать движущегося человека или номер движущегося автомобиля. При внешнем воздействии на камеру у нее срабатывает функция вмешательства, которая подает тревожный сигнал. Применение видеокамеры Samsung SCB-3001PH возможно как в единичном варианте, так и в охранной системе. Продается без объектива и кронштейна.",12816,img/11081.jpg
11082,Системы видеонаблюдения|Видеонаблюдение|Камеры видеонаблюдения,Samsung,Samsung SCB-4000P,"Данная цветная камера видеонаблюдения Samsung SCB-4000P на базе процессора A1 отличается поддержкой режима ""День/Ночь"", наличием шумоподавления и интеллектуального детектора движения. Соотношение сигнал шум менее 52дБ. Камера Samsung SCB-4000P способна формировать изображение разрешением до 700 ТВЛ, при этом минимум освещенности будет начинаться от 0,0002 люкс. Данная камера предназначена для установки в помещениях и может дополняться различными типами объективов, от которых будут зависеть возможности устройства. Благодаря поддержке протокола Coaxitron доступно управление по коаксиальному кабелю.",0,img/11082.jpg
11083,Системы видеонаблюдения|Видеонаблюдение|Камеры видеонаблюдения,Samsung,Samsung SCB-4000PH,"Samsung SCB-4000PH представляет собой цветную 1/2-дюймовую видеокамеру с ПЗС матрицей Ex-view и со сверхвысоким разрешением и широким динамическим диапазоном, имеет функцию SSNRIII (усовершенствованная технология шумоподавления). Высокое разрешение в цвете, с минимальной освещенностью, функция «День/ночь» с виртуальной прогрессивной разверткой (VPS), расширенный динамический диапазон (XDR); поддерживается управление по коаксиалу RS-485, 512х кратное увеличение чувствительности, OSD, С/СS крепление.",18842,img/11083.jpg
11084,Системы видеонаблюдения|Видеонаблюдение|Камеры видеонаблюдения,Samsung,Samsung SCB-2010P,АНАЛОГ ВЗАМЕН НА ВЫБОР,0,img/11084.jpg
11085,Системы видеонаблюдения|Видеонаблюдение|Камеры видеонаблюдения,Samsung,Samsung SCB-2020P,"Видеокамера Samsung SCB-2020P оснащена встроенным 3,7-мм объективом. Фокусное расстояние фиксированное. Устройство поддерживает управление при помощи коаксиального кабеля (CCVC). В оснащение включено интеллектуальное видео, MD, DNR (3D+2D), функция день/ночь, цифровая стабилизация изображения, детектор движения, с возможностью выключения; 12 программируемых зон маскирования. Камера поддерживает несколько языков экранного меню. Минимальное расстояние от объекта до камеры - 0,4м.",0,img/11085.jpg
11086,Системы видеонаблюдения|Видеонаблюдение|Камеры видеонаблюдения,Samsung,Samsung SCB-3020P,АНАЛОГ ВЗАМЕН: Samsung SCB-2010P,0,img/11086.jpg
11088,Системы видеонаблюдения|Видеонаблюдение|Камеры видеонаблюдения,Samsung,Samsung SCB-9060P,АНАЛОГ ВЗАМЕН НА ВЫБОР,0,img/11088.jpg
11089,Системы видеонаблюдения|Видеонаблюдение|Камеры видеонаблюдения,Samsung,Samsung SCB-9080P,АНАЛОГ ВЗАМЕН НА ВЫБОР,0,img/11089.jpg
11090,Системы видеонаблюдения|Видеонаблюдение|Камеры видеонаблюдения,Samsung,Samsung SCB-9090P,АНАЛОГ ВЗАМЕН НА ВЫБОР,0,img/11090.jpg
11091,Системы видеонаблюдения|Видеонаблюдение|Камеры видеонаблюдения,Samsung,Samsung SCD-2010FP,,0,img/11091.jpg
11092,Системы видеонаблюдения|Видеонаблюдение|Камеры видеонаблюдения,Samsung,Samsung SCD-2020RP,АНАЛОГ ВЗАМЕН: Samsung SCD-2080RP,0,img/11092.jpg
11093,Системы видеонаблюдения|Видеонаблюдение|Камеры видеонаблюдения,Samsung,Samsung SCD-2060EP,"Купольная камера Samsung SCD-2060EP без особого труда маскируется при помощи специально разработанного полусферического кожуха (купола). Существуют купола нескольких типов: зеркальные, затемненные и прозрачные, благодаря чему любая купольная камера маскируется под плафоны, что в свою очередь помогает скрыть движение объектива. Управление Samsung SCD-2060EP производится в двух режимах: ручном и автоматическом. Сама купольная камера вращается со скоростью 300 градусов в секунду, что делает эффективным использование всего одного устройства для видеонаблюдения в отдельном посещении.",0,img/11093.jpg
11094,Системы видеонаблюдения|Видеонаблюдение|Камеры видеонаблюдения,Samsung,Samsung SCD-2080RP,"Видеокамера SCD-2080RP, построенная на новом чипсете W-V DSP, имеет оптическую систему с двенадцатью светодиодами, сведоиндикатор способен автоматически перейти на монохромный режим работы при освещённости менее 4 Лк. Управление видеокамерой осуществляется централизованно, с помощью коаксиального кабеля. В наличии автоматическое переключение функции день/ночь при помощи подвижного ИК-фильтра. Есть возможность маскировки до 12 зон, путем вывода их из видеонаблюдения, что позволяет сохранять неприкосновенными факты личной жизни. В наличии также система обнаружения движения. При обнаружении опасности камера подает сигнал на пульт наблюдения. Зона действия и чувствительность задаются через экранное меню.",9360,img/11094.jpg
11095,Системы видеонаблюдения|Видеонаблюдение|Камеры видеонаблюдения,Samsung,Samsung SCD-2080EP,"Камера Samsung SCD-2080EP , построенная на новом чипсете W-V DSP, с высоким разрешением подходит для установки в помещениях, вплоть до холодных складов. Способна поддерживать несколько языков. Возможна аудиосвязь при использовании коаксиального кабеля. Малая освещённость не помешает успешной работе видеокамеры. Имеет встроенное крепление; до восьми программируемых зон у детектора движения, до двенадцати программируемых зон маскировки. Цвет слоновой кости не привлекает внимания. В наличии автоматическая диафрагма.",0,img/11095.jpg
11096,Системы видеонаблюдения|Видеонаблюдение|Камеры видеонаблюдения,Samsung,Samsung SCD-3081P,АНАЛОГ ВЗАМЕН: Samsung SCD-3083P,0,img/11096.jpg
11097,Системы видеонаблюдения|Видеонаблюдение|Камеры видеонаблюдения,Samsung,Samsung SCV-2081RP,АНАЛОГ ВЗАМЕН: Samsung SCD-2080RP,0,img/11097.jpg
11098,Системы видеонаблюдения|Видеонаблюдение|Камеры видеонаблюдения,Samsung,Samsung SCV-2010FRP,АНАЛОГ ВЗАМЕН НА ВЫБОР,0,img/11098.jpg
11099,Системы видеонаблюдения|Видеонаблюдение|Камеры видеонаблюдения,Samsung,Samsung SCV-2010FP,АНАЛОГ ВЗАМЕН НА ВЫБОР,0,img/11099.jpg
11100,Системы видеонаблюдения|Видеонаблюдение|Камеры видеонаблюдения,Samsung,Samsung SCV-2060P,"Корпус видеокамеры Samsung SCV-2060P взломоустойчив, имеет противоударный купол. Прибор оснащен микропроцессором цифровой обработки сигнала, усовершенствованным детектором движения, имеет уникальные функции интеллектуального анализа видеоизображения и виртуального прогрессивного сканирования. Экранное меню русифицировано. Технология Samsung-XDR / SSDR позволяет получить максимально контрастное и яркое изображение даже на затемненных местах картинки. Может монтироваться на поверхности или заподлицо. Прекрасно работает как в помещении, так и на открытом воздухе.",0,img/11100.jpg
11101,Системы видеонаблюдения|Видеонаблюдение|Камеры видеонаблюдения,Samsung,Samsung SCV-2080P,"Samsung SCV-2080P - неовейшие цветные антивандальные купольные видеокамеры сверхвысокого разрешения с ручным варифокальным объективом, компенсацией задней засветки и классом защиты от влаги и пыли IP66, для установки на улице (-50°+50°С). Камера имеет функцию День/Ночь с механическим ИК-фильтром. Камера имеет встроенный вариофокальный объектив с АРД. Также есть функции SSDR, BLC, WB, AGC, OSD, W-V DSP, SSNR III, DIS, и кроме этого детектор движения, 12 маскировочных зон, 16х цифровой ZOOM и зеркальный переворот изображения. Управление меню осуществляется через RS-485 и по Coaxitron.",0,img/11101.jpg
11102,Системы видеонаблюдения|Видеонаблюдение|Камеры видеонаблюдения,Samsung,Samsung SCV-3081RP,АНАЛОГ ВЗАМЕН НА ВЫБОР,0,img/11102.jpg
11103,Системы видеонаблюдения|Видеонаблюдение|Камеры видеонаблюдения,Samsung,Samsung SCV-3120P,"В основе купольной камеры видеонаблюдения Samsung SCV-3120P лежит процессор пятого поколения A1, собственная разработка Samsung. Он позволяет использовать такие технологии, как шумоподавление на картинке с движущимися обьектами, расширенный динамический диапазон и цифровая стабилизация изображения. Также в камере имеется детектор движения и возможность настройки маскировочных зон количеством до 12 штук. Камера способна формировать изображение в 600/700 ТВЛ при освещенности от  0.70/0,07/0,001 люкс в зависимости от режима работы. При этом стоит отметить защищеннность устройства - она соответствует стандарту IP66. Все это делает Samsung SCV-3120P подходящим решением для наблюдения в холлах зданий с большим количеством народа, на автостоянках и в гаражах.",0,img/11103.jpg
11104,Системы видеонаблюдения|Видеонаблюдение|Камеры видеонаблюдения,Samsung,Samsung SCO-2370P,АНАЛОГ ВЗАМЕН НА ВЫБОР,0,img/11104.jpg
11105,Системы видеонаблюдения|Видеонаблюдение|Камеры видеонаблюдения,Samsung,Samsung SCU-2370P,АНАЛОГ ВЗАМЕН: Samsung SCP-2370RHP,0,img/11105.jpg
11106,Системы видеонаблюдения|Видеонаблюдение|Камеры видеонаблюдения,Samsung,Samsung SCU-9051P,"Профессиональная камера видеонаблюдения Samsung SCU-9051P является тепловизором. Она обнаруживает объект или человека по тепловому излучению в технически сложных условиях, например, во время дождя, тумана, снега, в задымленных помещениях. Тепловизор устанавливается на поворотный механизм, что увеличивает обзор до 360 градусов, получает изображение при отличии температуры объекта от окружающей среды на 0,08 градуса, просматривает территорию в 1000 метров. Экранное меню многоязычное. Корпус выполнен из алюминия с влагозащитой и пылезащитой. Функция день/ночь со сдвигаемым ИК режекторным фильтром.",0,img/11106.jpg
11107,Системы видеонаблюдения|Видеонаблюдение|Камеры видеонаблюдения,Samsung,Samsung SCU-9080P,АНАЛОГ ВЗАМЕН НА ВЫБОР,0,img/11107.jpg
11108,Системы видеонаблюдения|Видеонаблюдение|Камеры видеонаблюдения,Samsung,Samsung SCU-9090P,"Samsung SCU-9090P осуществляет видеосъемку без необходимости во внешнем освещении за счет фиксации тепловых сигналов от объектов. Отличительной особенностью данной тепловизионной камеры является высокая чувствительность: она способна обнаружить источник инфракрасных лучей на расстоянии до 1000 метров, и детектор движения/температуры. Интегрированная система позиционирования камеры обеспечивает поворот в горизонтальной плоскости на 360°, в вертикальной плоскости на 85-40°. Кроме этого SCB-9090P изготовлена в термокожухе с защитой IP66, обеспечивающем бесперебойную работу в агрессивных погодных условиях от -50 до + 55°С. Такие функциональные возможности камеры позволяют использовать ее как на открытых пространствах за пределами помещений.",0,img/11108.jpg
11109,Системы видеонаблюдения|Видеонаблюдение|Камеры видеонаблюдения,Samsung,Samsung SCP-3120P,"Высокое качество изображения Samsung SCP-3120P формируется независимо от условий освещенности на объекте, благодаря использованию 1/4"" ПЗС-матрицы с двойной плотностью по вертикали и межстрочным переносом зарядов. Технология ""Сверхвысокое разрешение"", применяемая в камере, устраняет погрешности цветопередачи (муар) благодаря применению специального проходного оптического фильтра, что дает возможность получить картинку с разрешением по горизонтали в 700 ТВ линий, а также используя специальную методику обработки 12-битного последовательного аналогово-цифрового сигнала вместе с технологией улучшения элементов изображения. Кроме того, реализация алгоритма 3-х проходной обработки сигнала предупреждает появление шумов в условиях низкой освещенности. Работа направленного адаптивного фильтра совместно с управлением апертурного усиления уровнем освещенности обеспечивает более четкое и чистое изображение.",0,img/11109.jpg
