_ID_,_MAIN_CATEGORY_,_MANUFACTURER_,_NAME_,_DESCRIPTION_,_PRICE_,_IMAGE_
11358,Системы видеонаблюдения|IP-видеонаблюдение|Сетевые IP камеры,Smartec,Smartec STC-IPX3630A/1,"Smartec STC-IPX3630A/1 входит в серию IP-камер и IP-видеосерверов NEYRO, созданных на базе процессора DSP DaVinci, и подходит для осуществления видеонаблюдения в условиях слабой освещенности и в полной темноте. Как и другие модели серии, она снабжена базовым пакетом видеоаналитики VCA Presence английской компании VCA Technology, в дополнение к которому уличная IP-камера предусматривает использование расширенной версии VCA Surveillance и др. (путем активации лицензии на платной основе). Все настройки этих уличных моделей доступны при подключении через веб-браузер MS Internet Explorer после авторизации. Механическую настройку параметров изображения и регулировку объектива камеры позволяет выполнять без необходимости открывания кожуха – при помощи откидной крышки на корпусе камеры можно получить доступ к управлению объективом, а также к кнопкам навигации по системе экранных меню. Сетевая камера использует 1/3-дюймовую ПЗС-матрицу Sony SuperHAD II и формирует видео с высоким разрешением 600/700 ТВЛ в режимах «день/ночь» (ИК-подсветка выкл.). При недостаточном уровне освещения уличная IP-камера активирует работу 40 встроенных ИК-светодиодов с повышенной светоотдачей и обеспечивает дальность подсветки 40 м. Оператор может задать пороговое значение уровня освещения на объекте, при котором IP-камера будет переходить из режима «день» в режим «ночь» и обратно. Для предотвращения спорадических переключений режимов при кратковременной засветке чувствительного элемента в случае резких перепадов освещенности, уличные модели позволяют также настраивать задержку переключения режимов от 5 до 60 секунд.",0,img/11358.jpg
11359,Системы видеонаблюдения|IP-видеонаблюдение|Сетевые IP камеры,Beward,Beward B1062,АНАЛОГ ВЗАМЕН: Beward B1073,0,img/11359.jpg
11360,Системы видеонаблюдения|IP-видеонаблюдение|Сетевые IP камеры,Beward,Beward B1073,"Beward B1073 - камера, оснащенная ПЗС-сенсором Sony EXview HAD CCD II, который совместно с процессором Sony Effio-E позволяет получать более четкое изображение с повышенной детализацией благодаря увеличенному эффективному значению разрешения пикселей до 704х576. Цифровая система шумоподавления используется в камерах, чтобы избежать искажений изображения в условиях низкой освещенности. Технология Effio-E поддерживает 2D-NR цифровую систему шумоподавления. Эта система использует пространственный фильтр, анализирующий шумовые помехи в пределах одного кадра и помимо повышения качества изображения снижающий число помех в видеосигнале, позволяя видеокамере «день/ночь» экономить до 70% дискового пространства видеорегистратора системы видеонаблюдения в результате подавления шумовых составляющих видеосигнала.",8800,img/11360.jpg
11361,"Системы видеонаблюдения|IP-видеонаблюдение|Термокожухи, кронштейны, аксессуары",Beward,Beward B10xx-3GK12,АНАЛОГ ВЗАМЕН НА ВЫБОР,0,img/11361.jpg
11362,"Системы видеонаблюдения|IP-видеонаблюдение|Термокожухи, кронштейны, аксессуары",Beward,Beward B10xx-3GK220,АНАЛОГ ВЗАМЕН НА ВЫБОР,0,img/11362.jpg
11363,Системы видеонаблюдения|IP-видеонаблюдение|Сетевые IP камеры,Beward,Beward BD3570,"Сетевая видеокамера Beward BD3570 использует 3-х мегапиксельный сенсор с прогрессивным сканированием, который формирует изображение с разрешением 2048х1536. Наличие режима День/Ночь, АРД и механического ИК-фильтра выгодно отличает ее, позволяя соответствовать высоким требованиям, предъявляемым к современным системам видеонаблюдения. Используемая технология WDR (Широкий динамический диапазон), позволяет получить четкое, контрастное изображение даже в условиях больших перепадов яркости изображения, когда одни его участки освещены слишком ярко, а другие не освещены совсем. Это достигается за счет двойного открытия затвора за один кадр. Сначала используется высокая скорость затвора, а затем обычная. Соединение кадров дает изображение, на котором нет ни слишком ярких участков, ни слишком затемненных. При использовании данной технологии могут быть сняты многие ограничения, которые ранее накладывались местом установки камеры. Это окна в помещениях, засветка от фар автомобилей и т.д.",19300,img/11363.jpg
11364,Системы видеонаблюдения|IP-видеонаблюдение|Сетевые IP камеры,Beward,Beward BD4570,"Сетевая видеокамера Beward BD4570 использует 5-ти мегапиксельный сенсор с прогрессивным сканированием, который формирует изображение с разрешением 2592х1944. Наличие режима День/Ночь, АРД и механического ИК-фильтра выгодно отличает ее, позволяя соответствовать высоким требованиям, предъявляемым к современным системам видеонаблюдения. Используемая технология WDR (Широкий динамический диапазон), позволяет получить четкое, контрастное изображение даже в условиях больших перепадов яркости изображения, когда одни его участки освещены слишком ярко, а другие не освещены совсем. Это достигается за счет двойного открытия затвора за один кадр. Сначала используется высокая скорость затвора, а затем обычная. Соединение кадров дает изображение, на котором нет ни слишком ярких участков, ни слишком затемненных. При использовании данной технологии могут быть сняты многие ограничения, которые ранее накладывались местом установки камеры. Это окна в помещениях, засветка от фар автомобилей и т.д.",0,img/11364.jpg
11365,Системы видеонаблюдения|IP-видеонаблюдение|Сетевые IP камеры,Beward,Beward N1001,"Особенностью камеры Beward N1001 является работа под управлением сервиса CamDrive, который позволяет получать видеоизображение с камеры в режиме онлайн и записывать данные постоянно или по детектору движения. Сервис CamDrive позволяет управлять  видеоизображением и просматривать его при помощи обыкновенного веб-браузера без установки дополнительного программного обеспечения. Таким образом Вы можете получить доступ к видеоизображению с вашей камеры из сети Интернет из любого удобного для Вас места без всяких ограничений. Все это делает камеру оптимальным выбором для организации собственной системы видеонаблюдения. Используемый КМОП-сенсор позволяет получить высококачественное цветное изображение. Такой показатель, как чувствительность камеры позволяет обеспечить изображение с минимумом шумов и помех даже при слабом освещении, что обычно возможно только для камер на базе ПЗС-сенсора. Поэтому камеру можно использовать в большинстве случаев для установки и настройки системы видеонаблюдения в офисных и жилых помещениях, учебных центрах, квартирах, коттеджах и различных других территориях.",0,img/11365.jpg
11366,Системы видеонаблюдения|IP-видеонаблюдение|Сетевые IP камеры,Beward,Beward N1251,"Beward N1251 - это компактная цветная IP-камера со встроенным Wi-Fi модулем и светодиодной подсветкой (белый цвет) для круглосуточного видеонаблюдения с поддержкой работы совместно с сервисом хостингового видеонаблюдения CamDrive. Камера обладает возможностью работы под управлением сервиса CamDrive, что позволяет выгодно выделять ее среди других IP-камер. При помощи данного сервиса установить систему видеонаблюдения легко и быстро даже человеку, не обладающему специальными знаниями и навыками. CamDrive позволяет Вам удаленно наблюдать за происходящим в реальном времени с одной или нескольких камер, а также находить видеозапись в нужный день и время через удобный и понятный веб-интерфейс. Для подключения камеры может быть использовано как проводное, так и беспроводное соединение. Беспроводное подключение происходит благодаря встроенному модулю Wi-Fi. Использование этого интерфейса обеспечивает передачу данных со скоростью до 54 Мбит/с (в режиме 802.11 g). Для обеспечения конфиденциальности передаваемых данных камера поддерживает шифрование, делая недоступными их для злоумышленника.",0,img/11366.jpg
11367,Системы видеонаблюдения|Программное обеспечение для систем видеонаблюдения|ПО ITV,ITV,ITV SmartVideo V,ITV SmartVideo V - система цифрового видеонаблюдения с возможностью подключения 16 каналов видео по 25к/c. ,0,img/11367.jpg
11369,Домофонные системы|Домофоны|Видеодомофон,NeoVizus,NeoVizus ND-4PB2,АНАЛОГ ВЗАМЕН: NeoVizus ND-100,0,img/11369.jpg
11370,Домофонные системы|Домофоны|Видеодомофон,NeoVizus,NeoVizus ND-4HPTN,АНАЛОГ ВЗАМЕН: NeoVizus ND-100,0,img/11370.jpg
11371,Домофонные системы|Домофоны|Видеодомофон,NeoVizus,NeoVizus ND-4HPC,NeoVizus ND-4HPC - Видеодомофон с цветным экраном является  аналогом классической модели черно-белого домофона NeoVizus ND-4HP.  Использование цветного видеодомофона позволяет повысить информативность картинки с видеопанели и комфорт в его использовании.,0,img/11371.jpg
11372,Домофонные системы|Домофоны|Видеодомофон,NeoVizus,NeoVizus ND-100,Тонкий и компактный видеодомофон NeoVizus ND-100  отлично впишется в любой интерьер за счет своего привлекательного внешнего вида и аккуратной формы.,0,img/11372.jpg
11373,Домофонные системы|Домофоны|Видеодомофон,NeoVizus,NeoVizus ND-200,"NeoVizus ND-200 - видеодомофон с цветным экраном 5,6 дюймов обладает высокой информативностью и показывает посетителя  на четком и высококонтрастном экране.  Модель NeoVizus ND-200 – самая  бюджетная модель в линейке цветных видеодомофонов NeoVizus c большим цветным экраном и представляет собой самый доступный способ наблюдения за картинкой с двух видеопанелей на экране 5,6 “. ",0,img/11373.jpg
11374,Домофонные системы|Домофоны|Видеодомофон,NeoVizus,NeoVizus ND-200M,"Видеодомофон NeoVizus ND-200M оснащен встроенной памятью, предназначенной для записи фотографий и видеофрагментов посетителей с 2 видеопанелей за время Вашего отсутствия. ",0,img/11374.jpg
11375,Домофонные системы|Домофоны|Видеодомофон,NeoVizus,NeoVizus ND-201,"NeoVizus ND-201 - стильный цветной видеодомофон с экраном 5,6”, с улучшенной громкостью вызова и разговора. Надежный и простой в установке.",0,img/11375.jpg
11376,Домофонные системы|Домофоны|Видеодомофон,NeoVizus,NeoVizus ND-300,"Видеодомофон ND-300 имеет высококонтрастный цветной экран с диагональю 7”, что позволяет вести максимально информативное наблюдение за тем, что происходит перед видеопанелью. Этот домофон прекрасно впишется в любой интерьер за счет современного дизайна, перламутрового цвета корпуса и большого четкого экрана. ",0,img/11376.jpg
11377,Домофонные системы|Домофоны|Видеодомофон,NeoVizus,NeoVizus ND-300M,"Видеодомофон ND-300М оснащен встроенной памятью, предназначенной для записи фотографий и видеофрагментов посетителей с 2 видеопанелей за время Вашего отсутствия.",0,img/11377.jpg
11378,Домофонные системы|Домофоны|Видеодомофон,NeoVizus,NeoVizus ND-400,"Видеодомофон ND-400 не имеет аудиотрубки, за счет чего более компактен при креплении на стену и не занимает лишнего пространства.  Высококонтрастный цветной экран с диагональю 7” позволяет вести максимально информативное наблюдение за тем, что происходит перед видеопанелью.  Домофон прекрасно впишется в любой интерьер за счет современного дизайна, перламутрового цвета корпуса и большого четкого экрана.",0,img/11378.jpg
11379,Домофонные системы|Домофоны|Видеодомофон,NeoVizus,NeoVizus ND-400M,"Видеодомофон ND-400М оснащен встроенной памятью, предназначенной для записи фотографий и видеофрагментов посетителей с 2 видеопанелей за время Вашего отсутствия.",0,img/11379.jpg
11380,Домофонные системы|Домофоны|Видеодомофон,NeoVizus,NeoVizus ND-401,"Стильный белый видеодомофон NeoVizus ND-401, украшенный узором из голубых цветов на корпусе. Имеет лучшие настройки громкости вызова и разговора. Надежный и простой в установке.",0,img/11380.jpg
11385,Домофонные системы|Домофоны|Видеодомофон,NeoVizus,NeoVizus ND-4HPTN Visit,АНАЛОГ ВЗАМЕН: NeoVizus ND-200 Visit,0,img/11385.jpg
11386,Домофонные системы|Домофоны|Видеодомофон,NeoVizus,NeoVizus ND-4HPTN XL,АНАЛОГ ВЗАМЕН: NeoVizus ND-200 XL,0,img/11386.jpg
11387,Домофонные системы|Домофоны|Видеодомофон,NeoVizus,NeoVizus ND-4PB2 Visit,АНАЛОГ ВЗАМЕН: NeoVizus ND-200 Visit,0,img/11387.jpg
11388,Домофонные системы|Домофоны|Видеодомофон,NeoVizus,NeoVizus ND-4PB2 XL,АНАЛОГ ВЗАМЕН: NeoVizus ND-200 XL,0,img/11388.jpg
11389,Домофонные системы|Домофоны|Видеодомофон,NeoVizus,NeoVizus ND-4HPC Visit,NeoVizus ND-4HPC Visit - Видеодомофон с цветным экраном является  аналогом классической модели черно-белого домофона NeoVizus ND-4HP.  Использование цветного видеодомофона позволяет повысить информативность картинки с видеопанели и комфорт в его использовании. Модификация под координатный подъездный домофон.,0,img/11389.jpg
11390,Домофонные системы|Домофоны|Видеодомофон,NeoVizus,NeoVizus ND-4HPC XL,NeoVizus ND-4HPC XL - Видеодомофон с цветным экраном является  аналогом классической модели черно-белого домофона NeoVizus ND-4HP.  Использование цветного видеодомофона позволяет повысить информативность картинки с видеопанели и комфорт в его использовании. Модификация под цифровой подъездный домофон.,0,img/11390.jpg
11391,Домофонные системы|Домофоны|Видеодомофон,NeoVizus,NeoVizus ND-100 Visit,Тонкий и компактный видеодомофон NeoVizus ND-100 Visit отлично впишется в любой интерьер за счет своего привлекательного внешнего вида и аккуратной формы. Модификация под координатный подъездный домофон.,0,img/11391.jpg
11392,Домофонные системы|Домофоны|Видеодомофон,NeoVizus,NeoVizus ND-100 XL,Тонкий и компактный видеодомофон NeoVizus ND-100 XL отлично впишется в любой интерьер за счет своего привлекательного внешнего вида и аккуратной формы. Модификация под цифровой подъездный домофон.,0,img/11392.jpg
11393,Домофонные системы|Домофоны|Видеодомофон,NeoVizus,NeoVizus ND-200 Visit,"NeoVizus ND-200 Visit - видеодомофон с цветным экраном 5,6 дюймов обладает высокой информативностью и показывает посетителя  на четком и высококонтрастном экране.  Модель NeoVizus ND-200 – самая  бюджетная модель в линейке цветных видеодомофонов NeoVizus c большим цветным экраном и представляет собой самый доступный способ наблюдения за картинкой с двух видеопанелей на экране 5,6 “. ",0,img/11393.jpg
11394,Домофонные системы|Домофоны|Видеодомофон,NeoVizus,NeoVizus ND-200 XL,"NeoVizus ND-200 XL - видеодомофон с цветным экраном 5,6 дюймов обладает высокой информативностью и показывает посетителя  на четком и высококонтрастном экране.  Модель NeoVizus ND-200 – самая  бюджетная модель в линейке цветных видеодомофонов NeoVizus c большим цветным экраном и представляет собой самый доступный способ наблюдения за картинкой с двух видеопанелей на экране 5,6 “. ",0,img/11394.jpg
11395,Домофонные системы|Домофоны|Видеодомофон,NeoVizus,NeoVizus ND-200/M Visit,"NeoVizus ND-200/M Visit - видеодомофон, оснащен встроенной памятью, предназначенной для записи фотографий и видеофрагментов посетителей с 2 видеопанелей за время Вашего отсутствия. Модификация под координатный подъездный домофон.",0,img/11395.jpg
11396,Домофонные системы|Домофоны|Видеодомофон,NeoVizus,NeoVizus ND-200/M XL,"NeoVizus ND-200/M XL - видеодомофон, оснащен встроенной памятью, предназначенной для записи фотографий и видеофрагментов посетителей с 2 видеопанелей за время Вашего отсутствия. Модификация под цифровой подъездный домофон.",0,img/11396.jpg
