_ID_,_MAIN_CATEGORY_,_MANUFACTURER_,_NAME_,_DESCRIPTION_,_PRICE_,_IMAGE_
35321,"Системы контроля доступа|Турникеты, калитки, ограждения|Дополнительное оборудование к турникетам и калиткам",Oxgard,"Oxgard Praktika-t-04-k (с картоприемником, створки 1500 мм) 660мм","Турникет со стеклянными створками Oxgard Praktika-t-04-k (с картоприемником) представляет собой решение с картоприемником и распашными стеклянными створками (1500мм) в качестве преграждающего элемента. Преимущество данного турникета – высокая пропускная способность. Установка данного турникета позволяет обеспечить организованный выход при эвакуации, проход инвалидов или VIP-посетителей.",0,img/35321.jpg
35322,"Системы контроля доступа|Турникеты, калитки, ограждения|Дополнительное оборудование к турникетам и калиткам",Oxgard,Oxgard Крайний элемент турникета Praktika-t-04(со створками 1500мм) 660мм,"Oxgard Крайний элемент турникета Praktika-t-04 представляет собой правую или левую часть турникета с распашными стеклянными створками (1500мм). Элемент оснащен пультом управления, защищенным металлическим корпусом, датчиками прохода, электродвигателем, дверцой стойки со специальным замком для осуществления быстрого доступа, ключами от данного замка, стеклянной стенкой и стеклянной дверцой. Корпус элемента выполнен из шлифованной нержавеющей стали.",181698,img/35322.jpg
35323,"Системы контроля доступа|Турникеты, калитки, ограждения|Дополнительное оборудование к турникетам и калиткам",Oxgard,Oxgard Крайний элемент турникета Praktika-t-04(нормально открытый) 900мм,"Oxgard Крайний элемент турникета Praktika-t-04 представляет собой правую или левую часть турникета с распашными стеклянными створками (нормально открытый). Элемент оснащен пультом управления, защищенным металлическим корпусом, датчиками прохода, электродвигателем, дверцой стойки со специальным замком для осуществления быстрого доступа, ключами от данного замка, стеклянной стенкой и стеклянной дверцой. Корпус элемента выполнен из шлифованной нержавеющей стали.",275298,img/35323.jpg
35324,"Системы контроля доступа|Турникеты, калитки, ограждения|Дополнительное оборудование к турникетам и калиткам",Oxgard,"Oxgard Крайний элемент турникета Praktika-t-04-k(с картоприемником, со створками 1500мм) 660мм","Oxgard Крайний элемент турникета Praktika-t-04 представляет собой правую или левую часть турникета с распашными стеклянными створками (1500мм) и интегрированным картоприемником. Элемент оснащен пультом управления, защищенным металлическим корпусом, датчиками прохода, электродвигателем, дверцой стойки со специальным замком для осуществления быстрого доступа, ключами от данного замка, стеклянной стенкой и стеклянной дверцой. Корпус элемента выполнен из шлифованной нержавеющей стали.",222635,img/35324.jpg
35325,"Системы контроля доступа|Турникеты, калитки, ограждения|Дополнительное оборудование к турникетам и калиткам",Oxgard,Oxgard Центральный элемент турникета Praktika-t-04(со створками 1500мм) 660мм,"Центральный элемент турникета Praktika-t-04 представляет собой центральную часть турникета с распашными стеклянными створками (1500мм). Элемент оснащен пультом управления, защищенным металлическим корпусом, датчиками прохода, электродвигателями, дверцой стойки со специальным замком для осуществления быстрого доступа, ключами от данного замка, стеклянной стенкой и стеклянными дверцами. Корпус элемента выполнен из шлифованной нержавеющей стали.",229322,img/35325.jpg
35327,"Системы контроля доступа|Турникеты, калитки, ограждения|Дополнительное оборудование к турникетам и калиткам",Oxgard,"Oxgard Центральный элемент турникета Praktika-t-04-k (с картоприемником, со створками 1500мм) 660мм","Oxgard Центральный элемент турникета Praktika-t-04-k представляет собой центральную часть турникета с распашными стеклянными створками (1500мм) и интегрированным картоприемником. Элемент оснащен пультом управления, защищенным металлическим корпусом, датчиками прохода, электродвигателями, дверцой стойки со специальным замком для осуществления быстрого доступа, ключами от данного замка, стеклянной стенкой и стеклянными дверцами. Корпус элемента выполнен из шлифованной нержавеющей стали.",269673,img/35327.jpg
35332,Сетевое оборудование|Коммутаторы POE|Edimax ES-1008P,Edimax,Edimax ES-1008P,"Edimax ES-1008P является 8-портовым Fast Ethernet коммутатором с 8 PoE портами и создан для использования в малых и средних сетях. Этот компактный коммутатор - наилучший выбор для пользователей с ограниченным рабочим пространством. 

Соответствует стандарту IEEE 802.3at PoE (Power over Ethernet). Коммутатор Edimax ES-1008P имеет 8 IEEE 802.3at PoE (Power over Ethernet) портов с максимальной мощностью PoE питания 30 Вт на порт. Он преобразует стандартное питание 100~240 В переменного тока в постоянное и передает его по LAN кабелям на устройства, совместимые со стандартом IEEE 802.3at. Автоматически определит поддерживает ли подключенное устройство PoE стандарт IEEE 802.3at. Если устройство не поддерживает PoE, то по кабелю будут передаваться только данные. 

Коммутатор Edimax ES-1008P может подключаться к различным PoE продуктам, таким как точки доступа, IP камеры, IP телефоны и др. Это - наилучшее решение в случае, когда розетку электропитания трудно установить или она находится слишком далеко от точки расположения устройства. 

Не требуется специальный кабель Просто используйте стандартный Ethernet кабель 5й категории для подключения питаемых PoE устройств. Этот кабель передаст как питание так и данные. Не нужны дополнительные кабели питания. Это существенно уменьшит время и стоимость установки сети.",10929,img/35332.jpg
35333,Сетевое оборудование|Коммутаторы POE|Edimax ES-5816P,Edimax,Edimax ES-5816P,"Edimax ES-5816P является 16-портовым Fast Ethernet коммутатором с 16 PoE портами и создан для использования в малых и средних сетях. Этот компактный коммутатор - наилучший выбор для пользователей с ограниченным рабочим пространством. 

Соответствует стандарту IEEE 802.3af PoE (Power over Ethernet). Коммутатор Edimax ES-5816P имеет 16 IEEE 802.3af PoE (Power over Ethernet) портов. Он преобразует стандартное питание 100~240 В переменного тока в постоянное и передает его по LAN кабелям на устройства, совместимые со стандартом IEEE 802.3af. Автоматически определит поддерживает ли подключенное устройство PoE стандарт IEEE 802.3af. Если устройство не поддерживает PoE, то по кабелю будут передаваться только данные. 

Коммутатор ES-5816P может подключаться к различным PoE продуктам, таким как точки доступа, IP камеры, IP телефоны и др. Это - наилучшее решение в случае, когда розетку электропитания трудно установить или она находится слишком далеко от точки расположения устройства. 

Не требуется специальный кабель Просто используйте стандартный Ethernet кабель 5й категории для подключения питаемых PoE устройств. Этот кабель передаст как питание так и данные. Не нужны дополнительные кабели питания. Это существенно уменьшит время и стоимость установки сети.",29675,img/35333.jpg
35334,Сетевое оборудование|Коммутаторы POE|Edimax GS-1008P,Edimax,Edimax GS-1008P,"Edimax GS-1008P является 8-портовым Fast Ethernet коммутатором с 8 PoE портами и создан для использования в малых и средних сетях. Этот компактный коммутатор - наилучший выбор для пользователей с ограниченным рабочим пространством. 

Соответствует стандарту IEEE 802.3at PoE (Power over Ethernet). Коммутатор Edimax ES-1008P имеет 8 IEEE 802.3at PoE (Power over Ethernet) портов с максимальной мощностью PoE питания 30 Вт на порт. Он преобразует стандартное питание 100~240 В переменного тока в постоянное и передает его по LAN кабелям на устройства, совместимые со стандартом IEEE 802.3at. Автоматически определит поддерживает ли подключенное устройство PoE стандарт IEEE 802.3at. Если устройство не поддерживает PoE, то по кабелю будут передаваться только данные. 

Коммутатор Edimax ES-1008P может подключаться к различным PoE продуктам, таким как точки доступа, IP камеры, IP телефоны и др. Это - наилучшее решение в случае, когда розетку электропитания трудно установить или она находится слишком далеко от точки расположения устройства. 

Не требуется специальный кабель Просто используйте стандартный Ethernet кабель 5й категории для подключения питаемых PoE устройств. Этот кабель передаст как питание так и данные. Не нужны дополнительные кабели питания. Это существенно уменьшит время и стоимость установки сети.",14403,img/35334.jpg
35335,Сетевое оборудование|Коммутаторы POE|Edimax ES-5824PG,Edimax,Edimax ES-5824PG,"Edimax ES-5824PG является 24-портовым гигабитным PoE+ Web Smart стоечным коммутатором с 4 SFP портами, создан для усиления средних и больших сетей. Размер 19’’ и комплект крепления обеспечит установку в стандартную 19’’ стойку. Это наилучший выбор для увеличения производительности и эффективности вашей сети.",54645,img/35335.jpg
35345,Домофонные системы|Домофоны|Видеодомофон,Tantos,Tantos LILU LE,"Tantos LILU LE - монитор видеодомофона. Дизайн монитора 4,3 дюйма простой и изящный. Все управление осуществляется сенсорными кнопками. Может работать в одной системе с большинством мониторов ТМ ""Тантос"" (за исключением Violet, Thor, TDP-4HP/HPC)

Особенности:Подключение 2-х вызывных панелей
Подключение до 4-м мониторов в одной системе с широкими возможностями адресного интеркома
Работа как в индивидуальном, так и в многоквартирном режиме.
Совместимость с большинством моделей отечественных вызывных панелей
Цвет корпуса: белый
Толщина корпуса 17 мм
Выносной адаптер питания с возможностью установки в стеновую монтажную коробку (подрозетник) Д60мм",5040,img/35345.jpg
35346,Домофонные системы|Домофоны|Видеодомофон,Tantos,Tantos Blade,"Tantos Blade - комплект цветного беспроводного видеодомофона с монитором 4 дюйма, с сенсорными кнопками и зеркальной передней панелью

Идеален для тех кому нужен временный вариант видеодомофона или уже нет возможности проложить кабели связи.

Особенности:Для передачи аудио, видео сигнала используется цифровой канал связи ISM на частоте 2,402 – 2,4835 ГГц
Режим передачи аудио полностью дуплексный, используется CFSK модуляция.
Передача видео и аудио данных осуществляется одновременно.
Дальность связи может достигать 100 метров на открытом пространстве.
Используется технология адаптивной прыгающей частоты передачи.
Выбор случайных частот для передачи и синхронизация частотных каналов позволяет обеспечить высокий уровень защиты от помех и не влияет на работу других устройств.",10713,img/35346.jpg
35347,Системы видеонаблюдения|IP-видеонаблюдение|Сетевые IP камеры,RVi,RVi-IPC43DNS(6 мм),Трехмегапиксельная IP-камера RVi-IPC43DNS(6 мм) предназначена для решения широкого спектра задач наружного видеонаблюдения. Для работы в ночное время IP-камера RVi-IPC43DNS оснащена встроенной ИК-подсветкой дальностью до 30 метров и механическим ИК-фильтром.,9500,img/35347.jpg
35348,Системы видеонаблюдения|IP-видеонаблюдение|Сетевые IP камеры,RVi,RVi-IPC32MS(6 мм),,0,img/35348.jpg
35349,Системы контроля доступа|Доводчики дверные|Стандартные доводчики,Quantum,Quantum QM-D730(белый),"2-х скоростной дверной доводчик белого цвета Quantum QM-D730(белый) с зубчатым приводом, выдерживающий нагрузку до 65 кг. Данное устройство устанавливается на верхнюю часть двери и служит для автоматического её закрытия. В большинстве бюджетных инсталляций используются именно такие двухскоростные доводчики, как D730. При закрытии используется большая скорость, сменяющаяся на меньшую, когда дверь доходит до непосредственной близости к дверной коробке. Скорости регулируются в зависимости от конкретного случая. Рычаг доводчика QM-D730 при открытии двери перемещается по дуге, поворачивая систему зубчатых шестерен и сжимая пружину внутри доводчика, а при отпускании двери пружина разжимается и по той же схеме давит через рычаг на дверь в обратном направлении, тем самым закрывая её.",1566,img/35349.jpg
35350,Системы контроля доступа|Доводчики дверные|Стандартные доводчики,Quantum,Quantum QM-D730(серебряный),"2-х скоростной дверной доводчик серебристого цвета Quantum QM-D730(серебряный) с зубчатым приводом, выдерживающий нагрузку до 65 кг. Данное устройство устанавливается на верхнюю часть двери и служит для автоматического её закрытия. В большинстве бюджетных инсталляций используются именно такие двухскоростные доводчики, как D730. При закрытии используется большая скорость, сменяющаяся на меньшую, когда дверь доходит до непосредственной близости к дверной коробке. Скорости регулируются в зависимости от конкретного случая. Рычаг доводчика QM-D730 при открытии двери перемещается по дуге, поворачивая систему зубчатых шестерен и сжимая пружину внутри доводчика, а при отпускании двери пружина разжимается и по той же схеме давит через рычаг на дверь в обратном направлении, тем самым закрывая её.",1566,img/35350.jpg
35351,Системы контроля доступа|Доводчики дверные|Стандартные доводчики,Quantum,Quantum QM-D730(коричневый),"2-х скоростной дверной доводчик коричневого цвета Quantum QM-D730(коричневый) с зубчатым приводом, выдерживающий нагрузку до 65 кг. Данное устройство устанавливается на верхнюю часть двери и служит для автоматического её закрытия. В большинстве бюджетных инсталляций используются именно такие двухскоростные доводчики, как D730. При закрытии используется большая скорость, сменяющаяся на меньшую, когда дверь доходит до непосредственной близости к дверной коробке. Скорости регулируются в зависимости от конкретного случая. Рычаг доводчика QM-D730 при открытии двери перемещается по дуге, поворачивая систему зубчатых шестерен и сжимая пружину внутри доводчика, а при отпускании двери пружина разжимается и по той же схеме давит через рычаг на дверь в обратном направлении, тем самым закрывая её.",1566,img/35351.jpg
35352,Системы контроля доступа|Доводчики дверные|Стандартные доводчики,Quantum,Quantum QM-D740(белый),"2-х скоростной дверной доводчик белого цвета Quantum QM-D740(белый) с зубчатым приводом, выдерживающий нагрузку до 85 кг. Данное устройство устанавливается на верхнюю часть двери и служит для автоматического её закрытия. В большинстве бюджетных инсталляций используются именно такие двухскоростные доводчики, как D740. При закрытии используется большая скорость, сменяющаяся на меньшую, когда дверь доходит до непосредственной близости к дверной коробке. Скорости регулируются в зависимости от конкретного случая. Рычаг доводчика QM-D740 при открытии двери перемещается по дуге, поворачивая систему зубчатых шестерен и сжимая пружину внутри доводчика, а при отпускании двери пружина разжимается и по той же схеме давит через рычаг на дверь в обратном направлении, тем самым закрывая её.",1750,img/35352.jpg
