_ID_,_MAIN_CATEGORY_,_MANUFACTURER_,_NAME_,_DESCRIPTION_,_PRICE_,_IMAGE_
5001,Системы видеонаблюдения|IP-видеонаблюдение|Сетевые IP камеры,ACTi,ACTi ACM-3511,АНАЛОГ ВЗАМЕН: ACTi TCM-3511,0,img/5001.jpg
5002,Системы видеонаблюдения|IP-видеонаблюдение|Сетевые IP камеры,ACTi,ACTi ACM-3701,"Мегапиксельная IP камера ACM-3701 представляет собой миниатюрную конструкцию с 2-х дюймовым плафоном в форме полусферы. Корпус камеры вандалозащищен, влагонепроницаем и приспособлен для работы на улице при температурах -20°С до +50°С. Класс защиты от пыли и влаги IP-66.",0,img/5002.jpg
5003,Системы видеонаблюдения|IP-видеонаблюдение|Сетевые IP камеры,ACTi,ACTi ACM-3703,"Мегапиксельная IP камера ACM-3703 представляет собой миниатюрную конструкцию с 2-х дюймовым плафоном в форме полусферы. Корпус камеры вандалозащищен, влагонепроницаем и приспособлен для работы на улице при температурах -20°С до +50°С. Класс защиты от пыли и влаги IP-66.",0,img/5003.jpg
5005,Системы видеонаблюдения|IP-видеонаблюдение|Сетевые IP камеры,ACTi,ACTi ACM-3601,АНАЛОГ ВЗАМЕН: ACTi ACM-3701,0,img/5005.jpg
5006,Системы видеонаблюдения|IP-видеонаблюдение|Сетевые IP камеры,ACTi ,ACTi ACM-3603,АНАЛОГ ВЗАМЕН: ACTi ACM-3701,0,img/5006.jpg
5007,Системы видеонаблюдения|IP-видеонаблюдение|Сетевые IP камеры,ACTi,ACTi ACM-1231,Мегапиксельная IP камера ACM-1231 выпускается в цилиндрическом корпусе с ИК-подсветкой O75х220 мм предназначена для наружного применения при температурах от -20°С до +50°С (соответствует стандарту IP66). Установка этой IP камеры на стену производится при помощи кронштейна ACTi R695-00004-001. Встроенный детектор движения мегапиксельной IP камеры ACM-1231 позволяет выделить в кадре до 3-х зон для обнаружения движения. Пользователь может настраивать чувствительность детектора и минимальный размер движущихся объектов. Настенный кронштейн в комплект поставки не входит!,20930,img/5007.jpg
5008,Системы видеонаблюдения|IP-видеонаблюдение|Сетевые IP камеры,ACTi,ACTi ACM-1232,АНАЛОГ ВЗАМЕН: ACTi ACM-1231,0,img/5008.jpg
5009,Системы видеонаблюдения|IP-видеонаблюдение|Сетевые IP камеры,ACTi,ACTi ACM-1431,АНАЛОГ ВЗАМЕН: ACTi ACM-1231,0,img/5009.jpg
5010,Системы видеонаблюдения|IP-видеонаблюдение|Сетевые IP камеры,ACTi,ACTi ACM-1432,АНАЛОГ ВЗАМЕН: ACTi ACM-1231,0,img/5010.jpg
5011,Системы видеонаблюдения|IP-видеонаблюдение|Сетевые IP камеры,ACTi,ACTi ACM-5001,АНАЛОГ ВЗАМЕН: ACTi ACM-5611,0,img/5011.jpg
5012,Системы видеонаблюдения|IP-видеонаблюдение|Сетевые IP камеры,ACTi,ACTi ACM-5601,АНАЛОГ ВЗАМЕН: ACTi ACM-5611,0,img/5012.jpg
5013,Системы видеонаблюдения|IP-видеонаблюдение|Сетевые IP камеры,ACTi,ACTi ACM-5611,АНАЛОГ ВЗАМЕН: ACTi TCM-5611 или ACTi TCM-5111,0,img/5013.jpg
5014,Системы видеонаблюдения|IP-видеонаблюдение|Сетевые IP камеры,ACTi ,ACTi ACM-5711,АНАЛОГ ВЗАМЕН: ACTi TCM-5311,0,img/5014.jpg
5015,Системы видеонаблюдения|IP-видеонаблюдение|Сетевые IP камеры,ACTi,ACTi ACM-5811,АНАЛОГ ВЗАМЕН: ACTi TCM-5311,0,img/5015.jpg
5016,Системы видеонаблюдения|IP-видеонаблюдение|Сетевые IP камеры,ACTi,ACTi ACM-5801,АНАЛОГ ВЗАМЕН: ACTi TCM-5311,0,img/5016.jpg
5017,Системы видеонаблюдения|Видеонаблюдение|Камеры видеонаблюдения,Smartec,Smartec STC-3630/3 ULTIMATE,АНАЛОГ ВЗАМЕН: Smartec STC-3632/3 ULTIMATE,0,img/5017.jpg
5018,Системы видеонаблюдения|IP-видеонаблюдение|Сетевые IP камеры,ACTi,ACTI CAM-5201,IP камера ACTi CAM-5201 выпускаются в стандартном корпусе 63мм х 52мм х120 мм и  предназначены для внутреннего и наружного применения при температурах от -0°С до +50°С. Установка этой IP камеры внутри помещения на стену или потолок производится при помощи кронштейнов. Установка IP камеры ACTi ACM-5201 снаружи производится в термокожухе.,0,img/5018.jpg
5019,Системы видеонаблюдения|IP-видеонаблюдение|Сетевые IP камеры,ACTi ,ACTi CAM-5221,IP камера ACTi CAM-5221 выпускаются в стандартном корпусе 63мм х 52мм х120 мм и  предназначены для внутреннего и наружного применения при температурах от -0°С до +50°С. Установка этой IP камеры внутри помещения на стену или потолок производится при помощи кронштейнов. Установка IP камеры ACTi ACM-5201 снаружи производится в термокожухе.,0,img/5019.jpg
5020,Системы видеонаблюдения|IP-видеонаблюдение|Сетевые IP камеры,ACTi,ACTi CAM-5301,IP камера ACTi CAM-5301 выпускаются в стандартном корпусе 63мм х 52мм х120 мм и  предназначены для внутреннего и наружного применения при температурах от -0°С до +50°С. Установка этой IP камеры внутри помещения на стену или потолок производится при помощи кронштейнов. Установка IP камеры ACTi ACM-5201 снаружи производится в термокожухе.,0,img/5020.jpg
5021,Системы видеонаблюдения|IP-видеонаблюдение|Сетевые IP камеры,ACTi,ACTi CAM-5321,IP камера ACTi CAM-5321 выпускаются в стандартном корпусе 63мм х 52мм х120 мм и  предназначены для внутреннего и наружного применения при температурах от -0°С до +50°С. Установка этой IP камеры внутри помещения на стену или потолок производится при помощи кронштейнов. Установка IP камеры ACTi ACM-5201 снаружи производится в термокожухе.,0,img/5021.jpg
5022,Системы видеонаблюдения|IP-видеонаблюдение|Сетевые IP камеры,ACTi,ACTi TCM-5311,"Модель ACTi TCM-5311, первая из IP-камер ACTi, выполнена на мегапиксельной CCD-матрице Sony (ExviewHAD). IP камера TCM-5311 отличается от остальных IP-камер ACTi повышенной чувствительностью, более высокой частотой кадров отображения в мегапиксельном режиме – до 15 fps, типом компрессии H.264/MPEG-4/MJPEG.Компактная мегапикселная IP-камера стандартного дизайна идеально подходит для систем контроля магазинов, приемных в офисах или гостиницах, банков и других помещений.",0,img/5022.jpg
5023,Системы видеонаблюдения|IP-видеонаблюдение|Сетевые IP камеры,ACTi,ACTi TCM-5312,АНАЛОГ ВЗАМЕН: ACTi TCM-5311,0,img/5023.jpg
5024,Системы видеонаблюдения|IP-видеонаблюдение|Сетевые IP камеры,ACTi,ACTi TCM-5212,АНАЛОГ ВЗАМЕН: ACTi TCM-5311,0,img/5024.jpg
5025,Системы видеонаблюдения|IP-видеонаблюдение|Сетевые IP камеры,ACTi ,ACTi TCM-5211,АНАЛОГ ВЗАМЕН: ACTi TCM-5311,0,img/5025.jpg
5026,Системы видеонаблюдения|IP-видеонаблюдение|Сетевые IP камеры,ACTi,ACTi ACM-7411,"АНАЛОГ ВЗАМЕН: ACTi D82Описание ACTI ACM-7411 Мегапиксельная IP камера ACM-7411 в форме полусферы 151х114 мм выпускается в ударопрочном корпусе со встроенным обогревом и предназначена для наружного применения при температурах от -20°С до +50°С (соответствует стандарту IP66). Установка этих IP камер на стену производится при помощи кронштейна ACTi R695-00019-001. Специальное кольцо ACTi R695-00020-000 позволяет установить эту IP камеру в подвесном потолке. Механизм крепления IP камеры внутри корпуса обеспечивает направление камеры по горизонтали от 0 до 360 градусов, по вертикали от 0 до 180 градусов и вращение камеры вокруг своей оси.Встроенный детектор движения мегапиксельной IP камеры позволяет выделить в кадре до 3-х зон для обнаружения движения. Пользователь может настраивать чувствительность детектора и минимальный размер движущихся объектов. Для подключения сигналов тревог камера оснащена специальными входом и выходом. Камера может формировать до 4-х независимых MPEG4/MGPEG  потоков с различным разрешением и частотой кадров.В мегапиксельной IP камере используется 1/3” CMOS матрица Micron Progressive Scan с разрешением 1280х1024 и интегрированный варифокальный объектив f=3,3~12 мм. Эти IP камеры имеют функцию день/ночь и механический ИК-фильтр, переключающийся при освещенности менее 4 lux. Мегапиксельная IP камера имеет двунаправленный аудиоканал. Питание IP камеры может осуществляться от источника питания 12В или при помощи технологии PoE(IEEE 802.3af). Настройка мегапиксельной IP камеры  ACM-7411 осуществляется встроенным веб-интерфейсом. Все мегапиксельные IP камеры Acti настраиваются при помощи подробной пошаговой инструкции доступной обычному пользователю.Технические характеристики ACTi ACM-7411Разрешение 1280х1024
Чувствительность  Переключается в черно-белый режим при освещенности менее 4 lux
Датчик освещенности  есть
Объектив    Интегрированный варифокальный объектив f=3,3~12 mm
ИК-фильтр   механический
Детектор движения  3 зоны
Электронный затвор  1/5 ~ 1/2000 сек.
BLC  Есть
AGC  Автоматический или определяемый пользователем
Баланс белого  6 вариантов цветовых температур
Отношение сигнал/шум  44 db
Тип компрессии  MPEG4 SP, MJPEG по выбору пользователя
Разрешение  SXGA(1280x1024) , HD (1024x720), VGA (640x480), QVGA (320x240), QQVGA (116x112)
Аудио (Вход/Выход)  8 kHz, mono, PCM; Unbalanced 1,4Vp-p, 1Vrms,  terminal block
Ethernet  Ethernet (10/100 Base-T), RJ-45 connector
Подключение сигналов тревог  1 вход (СК), 1 выход ОК
Протоколы  TCP, UDP, IP, HTTP, DHCP, PPPoE, RTP, RTSP,FTP,SMTP,DNS,DDNS,NTP,ICMP,IGMP,ARP,3GPP
Веб браузер  IE 6,0 или выше
SDK  ACTi SDK-10000
Корпус  Ударопрочный, класс защиты IP66
Питание камеры  12 VDC(адаптер в комплект не входит) или PoE (IEEE 802.3af)
Габаритные размеры  Полусфера 151х114 мм
Вес 1040гДокументация ACTi ACM-7411Руководство пользователя ACM-7411Параметры ACTi ACM-7411Размер матрицыМакс. разрешение, Мпикс1.3Скорость при макс.разр. кадр/сек8ИК-подсветкаМинимальная светочувствительность, лк0.05Объектив3.3-12 ммPOEPOEПитание-Рабочая температураКласс защитыАнтивандальностьЗвук
 

                ",0,img/5026.jpg
5027,Системы видеонаблюдения|IP-видеонаблюдение|Сетевые IP камеры,ACTi ,ACTi ACM-7501,АНАЛОГ ВЗАМЕН: ACTi TCM-7811,0,img/5027.jpg
5028,Системы видеонаблюдения|IP-видеонаблюдение|Сетевые IP камеры,ACTi,ACTi ACM-7511,АНАЛОГ ВЗАМЕН: ACTi TCM-7811,0,img/5028.jpg
5043,Системы видеонаблюдения|IP-видеонаблюдение|Сетевые IP камеры,AXIS,AXIS 221 Outdoor Verso Kit,AXIS 221 Outdoor Verso Kit - комплект сетевой камеры и кожуха для уличного применения.,0,img/5043.jpg
5044,Системы видеонаблюдения|IP-видеонаблюдение|Сетевые IP камеры,AXIS,AXIS 223M Outdoor Verso Kit,AXIS 223M Outdoor Verso Kit - комплект сетевой камеры и кожуха для уличного применения.,0,img/5044.jpg
5045,Системы видеонаблюдения|IP-видеонаблюдение|Сетевые IP камеры,AXIS,AXIS Q1755 Outdoor T92A Kit,AXIS Q1755 Outdoor T92A Kit - комплект сетевой камеры и кожуха для уличного применения.,0,img/5045.jpg
5046,Системы видеонаблюдения|IP-видеонаблюдение|Сетевые IP камеры,AXIS,AXIS M3014 (0285-002),АНАЛОГ ВЗАМЕН: AXIS M3004-V (0516-001),0,img/5046.jpg
5047,Системы видеонаблюдения|IP-видеонаблюдение|Сетевые IP камеры,AXIS,AXIS M3203 (0336-001),AXIS M3203 - неподвижная купольная сетевая камера.,22065,img/5047.jpg
5048,Системы видеонаблюдения|IP-видеонаблюдение|Сетевые IP камеры,AXIS,AXIS M3203-V (0345-001),АНАЛОГ ВЗАМЕН: AXIS P3214-V (0612-001),0,img/5048.jpg
5049,Системы видеонаблюдения|IP-видеонаблюдение|Сетевые IP камеры,AXIS,AXIS M3204 (0337-001),AXIS M3204 - неподвижная купольная сетевая камера.,29432,img/5049.jpg
5050,Системы видеонаблюдения|IP-видеонаблюдение|Сетевые IP камеры,AXIS,AXIS M3204-V (0346-001),AXIS M3204-V - неподвижная купольная сетевая камера в вандалозащитном корпусе.,31791,img/5050.jpg
5054,Системы видеонаблюдения|IP-видеонаблюдение|Сетевые IP камеры,AXIS,AXIS P5534 50Hz OUTDOOR T95A10 KIT,"AXIS P5534 50Hz OUTDOOR T95A10 KIT - комплект сетевой купольной камеры AXIS P5534 и кожуха AXIS T92A10 для уличного применения, позволяет использовать камеру как внутри, так и вне помещений. Купольный кожух AXIS T95A10 представляют собой систему с открывающимся верхом,разработанную специально для облегчения доступа к камере, кабелям и соединениям и обеспечивающую простоту установки и технического обслуживания сетевой камеры. Сама же камера комплекта AXIS P5534 50Hz OUTDOOR T95A10 KIT представляет из себя сетевую купольную камеру AXIS P5534 PTZ, которая обеспечивает получение превосходного изображения формата HDTV и 18-кратное увеличение для ведения наблюдения внутри помещений.",0,img/5054.jpg
5055,Системы видеонаблюдения|IP-видеонаблюдение|Сетевые IP камеры,AXIS,AXIS Q1910 (0334-001),АНАЛОГ ВЗАМЕН: AXIS Q1931-E(7 mm),0,img/5055.jpg
5056,Системы видеонаблюдения|IP-видеонаблюдение|Сетевые IP камеры,AXIS,AXIS Q1910-E (0335-001),АНАЛОГ ВЗАМЕН:  AXIS Q1931-E(7 mm),0,img/5056.jpg
5057,Системы видеонаблюдения|IP-видеонаблюдение|Сетевые IP камеры,ACTi,ACTi ACM-8201,АНАЛОГ ВЗАМЕН: ACTi ACM-8511,0,img/5057.jpg
5058,Системы видеонаблюдения|IP-видеонаблюдение|Сетевые IP камеры,ACTi,ACTi ACM-8211,АНАЛОГ ВЗАМЕН: ACTi ACM-8511,0,img/5058.jpg
5060,Системы видеонаблюдения|IP-видеонаблюдение|Сетевые IP камеры,ACTi,ACTi CAM-6510,АНАЛОГ ВЗАМЕН: ACTi CAM-6610,0,img/5060.jpg
5061,Системы видеонаблюдения|IP-видеонаблюдение|Сетевые IP камеры,ACTi ,ACTi CAM-6630,"Сетевая купольная поворотная уличная IP камера ACTi CAM-6630 представляет новый качественный уровень камер видеонаблюдения и обладает функцией цифрового и электрического затвора, автоматического баланса белого. Создана для работы в слабоосвещенном месте и гарантируют четкое изображения в любых условиях по контрасту и освещенности.",0,img/5061.jpg
5062,Системы видеонаблюдения|IP-видеонаблюдение|Сетевые IP камеры,ACTi,ACTi CAM-6620,"Сетевая купольная поворотная уличная IP камера ACTi CAM-6620 представляет новый качественный уровень камер видеонаблюдения и обладает функцией цифрового и электрического затвора, автоматического баланса белого. Создана для работы в слабоосвещенном месте и гарантируют четкое изображения в любых условиях по контрасту и освещенности.",0,img/5062.jpg
5063,Системы видеонаблюдения|IP-видеонаблюдение|Сетевые IP камеры,ACTi,ACTi CAM-6610,"Сетевая купольная поворотная уличная IP камера ACTi CAM-6610 представляет новый качественный уровень камер видеонаблюдения и обладает функцией цифрового и электрического затвора, автоматического баланса белого. Создана для работы в слабоосвещенном месте и гарантируют четкое изображения в любых условиях по контрасту и освещенности.",0,img/5063.jpg
5064,Системы видеонаблюдения|IP-видеонаблюдение|Сетевые IP камеры,ACTi,ACTi CAM-7322,"IP камера ACTi CAM-7322 в форме полусферы 151х114 мм выпускаются в ударопрочном корпусе со встроенным обогревом и предназначена для наружного применения при температурах от -30°С до +50°С (соответствует стандарту IP66). Установка этой IP камеры на стену производится при помощи кронштейна ACTi R695-00019-001. Специальное кольцо ACTi R695-00020-000 позволяет установить эту IP камеру в подвесном потолке. Механизм крепления IP камеры внутри корпуса обеспечивает направление камеры по горизонтали от 0 до 360 градусов, по вертикали от 0 до 180 градусов и вращение камеры вокруг своей оси. ",0,img/5064.jpg
5065,Системы видеонаблюдения|IP-видеонаблюдение|Сетевые IP камеры,ACTi ,ACTi CAM-7321,"IP камера ACTi CAM-7321 в форме полусферы O151х114 мм выпускаются в ударопрочном корпусе со встроенным обогревом и предназначена для наружного применения при температурах от -30°С до +50°С (соответствует стандарту IP66). Установка этой IP камеры на стену производится при помощи кронштейна ACTi R695-00019-001. Специальное кольцо ACTi R695-00020-000 позволяет установить эту IP камеру в подвесном потолке. Механизм крепления ip камеры внутри корпуса обеспечивает направление камеры по горизонтали от 0 до 360 градусов, по вертикали от 0 до 180 градусов и вращение камеры вокруг своей оси. ",0,img/5065.jpg
5066,Системы видеонаблюдения|IP-видеонаблюдение|Сетевые IP камеры,ACTi,ACTi CAM-7301,"IP камера ACTi CAM-7301 в форме полусферы 151х114 мм выпускаются в ударопрочном корпусе со встроенным обогревом и предназначена для наружного применения при температурах от -30°С до +50°С (соответствует стандарту IP66). Установка этой IP камеры на стену производится при помощи кронштейна ACTi R695-00019-001. Специальное кольцо ACTi R695-00020-000 позволяет установить эту IP камеру в подвесном потолке. Механизм крепления IP камеры внутри корпуса обеспечивает направление камеры по горизонтали от 0 до 360 градусов, по вертикали от 0 до 180 градусов и вращение камеры вокруг своей оси. ",0,img/5066.jpg
