_ID_,_MAIN_CATEGORY_,_MANUFACTURER_,_NAME_,_DESCRIPTION_,_PRICE_,_IMAGE_
21549,"Источники электропитания|Источники питания до 12В|СКАТ Моллюск 5/2,5",СКАТ,"СКАТ Моллюск 5/2,5",АНАЛОГ ВЗАМЕН НА ВЫБОР,0,img/21549.jpg
21550,"Источники электропитания|Источники питания до 12В|СКАТ Моллюск 12/1,5",СКАТ,"СКАТ Моллюск 12/1,5","Уникальный на российском рынке источник питания СКАТ Моллюск 12/1,5 для скрытой установки в кабельные каналы, электротехнические распаечные (соединительные) коробки, кожух видеокамеры. Корпус позволяет установку в любом месте, даже под штукатурку. Установи источник там, где надо, а не там, где есть свободное место. Источник питания предназначен для питания радиоэлектронных устройств широкого применения напряжением 12 В постоянного тока от сети переменного тока напряжением 220 В, защищен от перегрузки и короткого замыкания на выходе, работоспособен на холостом ходу.
",580,img/21550.jpg
21551,Системы видеонаблюдения|Видеонаблюдение|Камеры видеонаблюдения,RVi,RVi-429IR (2.8-12 мм),АНАЛОГ ВЗАМЕН: RVi-C321(2.8-12 мм),0,img/21551.jpg
21590,Системы охранно-пожарной сигнализации|ОПС Ademco|Релейные модули,Ademco,Ademco 4204,"Ademco 4204 - релейный модуль предназначен для использования с контрольными панелями «ВИСТА», кроме ВИСТА 101/121/481. Содержит 4 реле типа С (нормально замкнутые и нормально разомкнутые контакты). Каждое реле может использоваться независимо для различных функций. Реле могут работать в трех режимах: краткосрочное включение; запуск-остановка по событиям; пульсация. В качестве событий могут быть тревога, неисправность по списку зон, по типу зоны, а также одно из системных событий.",3914,img/21590.jpg
21591,Системы охранно-пожарной сигнализации|ОПС Ademco|Расширители,Ademco,Ademco 4208U,"Ademco 4208U - универсальный модуль расширения на восемь зон. Модуль представляет собой адресный расширитель на 8 зон (шлейфов сигнализации), позволяющий использовать доступные зоны расширения. Питание модуля осуществляется по шине данных V-Plex™ от контрольной панели. При необходимости модуль может запитываться от внешнего источника постоянного тока для снижения нагрузки на шину V-Plex
Восемь шлейфов с оконечными резисторами (все шлейфы используют резисторы номиналом 10 кОм, входящими в комплект поставки). DIP-переключатели могут использоваться для установки номеров зон или серийных номеров. При использовании режима серийных номеров каждый серийный номер в выбранной группе может назначаться любой зоне. Шлейфы А и В могут программироваться для обеспечения быстрого реагирования (10 мс). Встроенный датчик вмешательства на открывание корпуса, который может включаться/выключаться с помощью встроенных DIP-переключателей",3392,img/21591.jpg
21592,Системы охранно-пожарной сигнализации|ОПС Ademco|Расширители,Ademco,Ademco 4209U,Ademco 4209U - модуль группового зонирования обеспечивает гибкость при создании больших или территориально-распределенных систем. При расширении существующей системы возможно использование проводных детекторов дыма (согласно перечню соответствия UL) и проводку для расширения возможностей всей системы. 4209U также обеспечивает гибкое конфигурирование зон в соответствии с требованиями охраняемого объекта.,3549,img/21592.jpg
21593,Системы охранно-пожарной сигнализации|ОПС Ademco|Расширители,Ademco,Ademco 4229,"Ademco 4229 - модуль расширения до 8 зон на мультиплексной линии. Модуль имеет дополнительно выходы на 2 исполнительных адресных реле. Является дополнительным устройством систем ADEMCO (только для централей Vista-25). Может монтироваться как в корпусе централи, так и в отдельном корпусе. Каждая из 8 зон программируется индивидуально. Одна линия может программироваться на быстрый тип реагирования (10-15мс.). Подключаются к консольной шине.",4566,img/21593.jpg
21594,Системы охранно-пожарной сигнализации|ОПС Ademco|Релейные модули,Ademco,Ademco 4297,"Ademco 4297 - токовый усилитель двухпроводной сигнальной линии является вспомогательным оборудованием для панелей «ВИСТА», использующих петлю опроса. Предназначен для обеспечения дополнительного тока нагрузки в двухпроводной линии, увеличения длины линии и/или организации нескольких электрически независимых участков сигнальной линии связи. При использовании аккумулятора емкостью 1,2 А/ч гарантировано бесперебойное питание до 4 часов. Время перезарядки аккумулятора - 48 часов. Используется в случае, когда длина двухпроводной адресной линии больше рекомендуемой или потребление тока адресными устройствами более 64 мА.",3908,img/21594.jpg
21628,Системы охранно-пожарной сигнализации|ОПС Ademco|Релейные модули,Ademco,Ademco 4100-SM,"Ademco 4100-SM - модуль последовательного интерфейса, предназначенный для подключения ПК или принтера.",5577,img/21628.jpg
21648,Системы охранно-пожарной сигнализации|Извещатели охранные для наружной установки|Извещатели радиоволновые объемные,Аргус-Спектр,Аргус-Спектр «Фон–3» Блок программирования,Аргус-Спектр «Фон–3» Блок программирования  предназначен для настройки дальности действия и контроля работоспособности извещателей «Фон-3» (3Т) и «Фон-3/1» (3/1Т).,2662,img/21648.jpg
21661,"Системы охранно-пожарной сигнализации|ОПС Аргус-Спектр|Интегрированная система ""Стрелец-Интеграл""",Аргус-Спектр,Аргус-Спектр ИПР–И (ИП 535-1/1-РА),"Аргус-Спектр ИПР–И (ИП 535-1/1-РА)  предназначен для ручного включения сигнала тревоги и передачи извещения о пожаре на адресно-аналоговый прибор приемно-контрольный пожарный ИСБ ""Стрелец-Интеграл"" (БСЛ240–И).",2257,img/21661.jpg
21709,"Системы охранно-пожарной сигнализации|ОПС Аргус-Спектр|Радиоканальная система ""РАДИОКНОПКА""",Аргус-Спектр,"Аргус-Спектр БВИ ""РСТС"" Радиокнопка","Аргус-Спектр БВИ ""РСТС"" Радиокнопка  предназначен для дистанционной беспроводной передачи тревожных извещений. Область   применения - централизованная или автономная охрана объектов и людей.",1054,img/21709.jpg
21710,"Системы охранно-пожарной сигнализации|ОПС Аргус-Спектр|Радиоканальная система ""РАДИОКНОПКА""",Аргус-Спектр,Аргус-Спектр РПД-РБ,Аргус-Спектр РПД-РБ  предназначен для беспроводной передачи тревожных извещений при централизованной или   автономной охране объектов или людей. Тревожное извещение передается при   нажатии тревожной кнопки РПД-РБ.,0,img/21710.jpg
21711,"Системы охранно-пожарной сигнализации|ОПС Аргус-Спектр|Радиоканальная система ""РАДИОКНОПКА""",Аргус-Спектр,"Аргус-Спектр Радиокнопка РПД-КН лит.1, вар.2","Аргус-Спектр Радиокнопка РПД-КН лит.1, вар.2 предназначен для беспроводной передачи тревожных извещений при централизованной или   автономной охране объектов или людей. Тревожное извещение передается при   нажатии тревожной кнопки РПД-КН лит.1, вар.2 исп. 1 или нарушении шлейфа сигнализации на   охраняемом объекте.",2519,img/21711.jpg
21712,"Системы охранно-пожарной сигнализации|ОПС Аргус-Спектр|Радиоканальная система ""РАДИОКНОПКА""",Аргус-Спектр,Аргус-Спектр БОИ-6,"Аргус-Спектр БОИ-6 предназначен для работы в составе РСТС ""Радиокнопка"" совместно с радиоприемными устройствами РПУ-А или РПУ. Осуществляет обработку извещений от 6 радиопередатчиками РПД и выдачу   обобщенного сигнала тревоги путем размыкания контактов одного реле и   замыкания контактов другого.",2601,img/21712.jpg
21713,"Системы охранно-пожарной сигнализации|ОПС Аргус-Спектр|Радиоканальная система ""РАДИОКНОПКА""",Аргус-Спектр,Аргус-Спектр БДА,"Аргус-Спектр БДА предназначен для работы в составе РСТС ""Радиокнопка"" совместно с РПУ или БОИ-6. Служит для формирования отдельных тревожных извещений от каждого радиопередатчика (РПД), входящего в состав РСТС.",2008,img/21713.jpg
21714,"Системы охранно-пожарной сигнализации|ОПС Аргус-Спектр|Радиоканальная система ""РАДИОКНОПКА""",Аргус-Спектр,"Аргус-Спектр Радиокнопка РПД-КН лит.1, вар.1","Аргус-Спектр Радиокнопка РПД-КН лит.1, вар.1 предназначен для беспроводной передачи тревожных извещений при централизованной или   автономной охране объектов или людей. Тревожное извещение передается при   нажатии тревожной кнопки РПД-КН лит.1, вар.1 исп. 1 или нарушении шлейфа сигнализации на   охраняемом объекте.",3059,img/21714.jpg
21715,"Системы охранно-пожарной сигнализации|ОПС Аргус-Спектр|Радиоканальная система ""РАДИОКНОПКА""",Аргус-Спектр,"Аргус-Спектр Радиокнопка РПД-КН лит.1, вар.2, исп.2","Аргус-Спектр Радиокнопка РПД-КН лит.1, вар.2, исп.2  предназначен для беспроводной передачи тревожных извещений при централизованной или   автономной охране объектов или людей. Тревожное извещение передается при   нажатии тревожной кнопки РПД-КН лит.1, вар.2 исп.2 или нарушении шлейфа сигнализации на   охраняемом объекте.",2654,img/21715.jpg
21716,"Системы охранно-пожарной сигнализации|ОПС Аргус-Спектр|Радиоканальная система ""РАДИОКНОПКА""",Аргус-Спектр,Аргус-Спектр РПУ лит.1,"Аргус-Спектр РПУ лит.1 предназначен для: приема тревожных извещений от 6 различных передающих устройств; дешифрации сигналов; отображения на Блоке Выносных Индикаторов (БВИ); передачи извещений на ПЦН, компьютер, Блок Дешифрации Адреса (БДА) или дополнительные блоки обработки. ",4499,img/21716.jpg
21717,"Системы охранно-пожарной сигнализации|ОПС Аргус-Спектр|Радиоканальная система ""РАДИОКНОПКА""",Аргус-Спектр,"Аргус-Спектр Радиокнопка РПД-КН лит.1, вар.1, исп.2","Аргус-Спектр Радиокнопка РПД-КН лит.1, вар.1, исп.2 предназначен для беспроводной передачи тревожных извещений при централизованной или   автономной охране объектов или людей. Тревожное извещение передается при   нажатии тревожной кнопки РПД-КН лит.1, вар.1 исп.2 или нарушении шлейфа сигнализации на   охраняемом объекте.",3171,img/21717.jpg
21719,"Системы охранно-пожарной сигнализации|ОПС Аргус-Спектр|Радиоканальная система ""РАДИОКНОПКА""",Аргус-Спектр,Аргус-Спектр БОИ-96,"Аргус-Спектр БОИ-96 предназначен для цифровой обработки и отображения служебных и тревожных извещений, поступающих от любых радиопередатчиков РСТС ""Радиокнопка"", а также организации автоматизированного ПЦН для контроля 96 охраняемых объектов, сигналы которых поступают от РПУ-А.",4182,img/21719.jpg
21720,"Системы охранно-пожарной сигнализации|ОПС Аргус-Спектр|Радиоканальная система ""РАДИОКНОПКА""",Аргус-Спектр,Аргус-Спектр РПУ лит.1 исп.2,"Аргус-Спектр РПУ лит.1 исп.2 предназначен для: приема тревожных извещений от 6 различных передающих устройств; дешифрации сигналов; отображения на Блоке Выносных Индикаторов (БВИ); передачи извещений на ПЦН, компьютер, Блок Дешифрации Адреса (БДА) или дополнительные блоки обработки. ",4586,img/21720.jpg
21721,"Системы охранно-пожарной сигнализации|ОПС Аргус-Спектр|Радиоканальная система ""РАДИОКНОПКА""",Аргус-Спектр,Аргус-Спектр РПД-РК,"Аргус-Спектр РПД-РК предназначен для организации охраны мест хранения наличных денежных средств. Сигнал ""Тревога"" формируется при изменении положения устройства. ",5418,img/21721.jpg
21731,"Системы охранно-пожарной сигнализации|ОПС Аргус-Спектр|Интегрированная система ""Стрелец-Интеграл""",Аргус-Спектр,Аргус-Спектр Аврора-3П,"Аргус-Спектр Аврора-3П предназначен для программирования и считывания адреса адрсено-аналоговых извещателей: дымовых (Аврора–ДИ, Аврора–ДИ исп.2); тепловых (Аврора–ТИ, Аврора–ТИ исп.2, Аврора–ТИ-В, Аврора–ТИ-В исп.2); комбинированных (Аврора–ДТИ, Аврора–ДТИ исп.2); ручного (ИПР–И); линейного (Амур–И). Модулей: входных (МВ–И, М–МВ–И, МК–МВ–И, DIN–МВ–И); исполнительных (МИ–И, М–МИ–И, МК–МИ–И, DIN–МИ–И); релейных (МР–И, М–МР–И, МК–МР–И, DIN–МР–И); комбинированных (МВИ–И, М–МВИ–И, МВР–И, М–МВР–И). Оповещателей (Сирена–И, Сирена–И исп. Строб). Охранных извещателей (Икар–5И, РИГ–И, Арфа–И).Питание Аврора-3П осуществляется от батареи 9 В, типа «Крона» (6LR61).Технические характеристики Аргус-Спектр Аврора-3П диапазон рабочих температур - -30...+50 °СДокументация Аргус-Спектр Аврора-3П   Руководство по эксплуатации Аргус-Спектр Аврора-3П   Параметры Аргус-Спектр Аврора-3П
 

                ",4629,img/21731.jpg
21749,Системы охранно-пожарной сигнализации|ОПС Аргус-Спектр|Системы передачи извещений по радиоканалу стандарта GSM,Аргус-Спектр,Аргус-Спектр УОО-АВ исп. 1,Аргус-Спектр УОО-АВ исп. 1 предназначен для передачи извещений от приёмно-контрольных приборов охранно-пожарной   сигнализации (ППКОП) на пульт централизованного наблюдения (ПЦН) по   коммутируемым абонентским линиям городской телефонной сети.,0,img/21749.jpg
21750,Системы охранно-пожарной сигнализации|ОПС Аргус-Спектр|Системы передачи извещений по радиоканалу стандарта GSM,Аргус-Спектр,Аргус-Спектр Тандем-1,Аргус-Спектр Тандем-1 предназначен для передачи извещений о состоянии средств охранно-пожарной сигнализации на пульты централизованного наблюдения.,15429,img/21750.jpg
21754,Системы охранно-пожарной сигнализации|ОПС Аргус-Спектр|Системы передачи извещений по радиоканалу стандарта GSM,Аргус-Спектр,Аргус-Спектр Тандем-2М (УОО-АВ исп.5/2),Аргус-Спектр Тандем-2М (УОО-АВ исп.5/2)   предназначен для передачи извещений о состоянии средств охранно-пожарной сигнализации на: станции мониторинга или пульты централизованного наблюдения; сотовые телефоны пользователей.,13120,img/21754.jpg
21760,Системы охранно-пожарной сигнализации|Извещатели охранные для помещений|Извещатели оптико-электронные пассивные,Теко,Теко Астра-515 исп. А,"Теко Астра-515 исп. А - охранный оптико-электронный извещатель  производства компании «ТЕКО». Извещатель  предназначен для обнаружения проникновения в охраняемое пространство закрытого помещения и формирования извещения о проникновении путем размыкания выходных контактов сигнального реле. В извещателе  предусмотрено несколько режимов работы, устанавливаемых с помощью двух перемычек и задаваемых исходя из конкретных условий применения и тактики охраны.",333,img/21760.jpg
21761,Системы охранно-пожарной сигнализации|Извещатели охранные для помещений|Извещатели оптико-электронные пассивные,Теко,Теко Астра-515 исп. Б,"Теко Астра-515 исп. Б - извещатель инфракрасный пассивный поверхностный. Обнаружение проникновения в охраняемое пространство закрытого помещения и формирование извещения о тревоге путем размыкания выходных контактов сигнального реле. Из особенностей можно отметить: дискретная регулировка обнаружительной способности,оптоэлектронное реле,устойчивость к внешней засветке не менее 6500 лк и комплектация угловым кронштейном.",333,img/21761.jpg
21762,Системы охранно-пожарной сигнализации|Извещатели охранные для помещений|Извещатели оптико-электронные пассивные,Теко,Теко Астра-9,"Теко Астра-9 - извещатель объёмный оптико-электронный  предназначен для обнаружения проникновения в охраняемое пространство и формирования извещения о тревоге путём размыкания выходных контактов сигнального реле. Электропитание извещателя  осуществляется от любого источника постоянного тока с номинальным напряжением 12 В с амплитудой пульсации не более 0,1 В. Конструктивно извещатель объёмный оптико-электронный  выполнен в виде блока, состоящего из основания и съёмной крышки.",407,img/21762.jpg
