_ID_,_MAIN_CATEGORY_,_MANUFACTURER_,_NAME_,_DESCRIPTION_,_PRICE_,_IMAGE_
32001,Системы видеонаблюдения|IP-видеонаблюдение|Сетевые IP камеры,Space Technology,Space Technology St-120 IP,АНАЛОГ ВЗАМЕН:  	Space Technology ST-120 M IP,0,img/32001.jpg
32002,Системы видеонаблюдения|IP-видеонаблюдение|Сетевые IP камеры,Space Technology,Space Technology St-180 IP,АНАЛОГ ВЗАМЕН:Space Technology St-181 IP,0,img/32002.jpg
32003,Системы видеонаблюдения|IP-видеонаблюдение|Сетевые IP камеры,Space Technology,Space Technology St-181 IP,АНАЛОГ ВЗАМЕН:  Space Technology ST-181 IP HOME,0,img/32003.jpg
32004,Системы видеонаблюдения|IP-видеонаблюдение|Сетевые IP камеры,Space Technology,Space Technology St-182 IP,АНАЛОГ ВЗАМЕН: Space Technology St-182 IP M ,0,img/32004.jpg
32005,Системы видеонаблюдения|IP-видеонаблюдение|IP Видеорегистраторы гибридные,Space Technology,Space Technology St HDVR-0411 NVR/HYBRID,АНАЛОГ ВЗАМЕН: Space Technology St DVR-0442 HYBRID/NVR,0,img/32005.jpg
32006,Системы видеонаблюдения|IP-видеонаблюдение|IP Видеорегистраторы (NVR),Space Technology,Space Technology St NVR-0454,АНАЛОГ ВЗАМЕН НА ВЫБОР,0,img/32006.jpg
32007,Системы видеонаблюдения|IP-видеонаблюдение|IP Видеорегистраторы гибридные,Space Technology,Space Technology St DVR-0442 HYBRID/NVR,АНАЛОГ ВЗАМЕН НА ВЫБОР,0,img/32007.jpg
32008,Системы видеонаблюдения|IP-видеонаблюдение|IP Видеорегистраторы гибридные,Space Technology,Space Technology St DVR-0884 HYBRID/NVR,,0,img/32008.jpg
32009,Системы видеонаблюдения|IP-видеонаблюдение|IP Видеорегистраторы (NVR),Space Technology,Space Technology St NVR-0841,АНАЛОГ ВЗАМЕН НА ВЫБОР,0,img/32009.jpg
32010,Системы видеонаблюдения|IP-видеонаблюдение|IP Видеорегистраторы гибридные,Space Technology,Space Technology ST DVR-1616 HYBRID/NVR,,0,img/32010.jpg
32011,Системы видеонаблюдения|IP-видеонаблюдение|IP Видеорегистраторы гибридные,Space Technology,Space Technology St HDVR-1616 NVR/HYBRID,,0,img/32011.jpg
32012,Системы видеонаблюдения|IP-видеонаблюдение|Объективы мегапиксельные,Space Technology,Space Technology ST-12-3MPBL,Модель Space Technology ST-12-3MPBL представляет собой современный 3-мегапиксельный объектив для камер видеонаблюдения. Устройство оснащено фиксированным фокусным расстоянием 12 мм.,515,img/32012.jpg
32013,Системы видеонаблюдения|IP-видеонаблюдение|Объективы мегапиксельные,Space Technology,"Space Technology ST-2,8-3MPBL","Модель Space Technology ST-2,8-3MPBL представляет собой современный 3-мегапиксельный объектив. Предназначен для камер видеонаблюдения. Устройство оснащено фиксированным фокусным расстоянием 2.8 мм.",366,img/32013.jpg
32014,Системы видеонаблюдения|IP-видеонаблюдение|Объективы мегапиксельные,Space Technology,Space Technology ST-6-3MPBL,Модель Space Technology ST-6-3MPBL - это современный 3-мегапиксельный объектив. Предназначен для камер видеонаблюдения. Устройство оснащено фиксированным фокусным расстоянием 6 мм.,181,img/32014.jpg
32015,Системы видеонаблюдения|IP-видеонаблюдение|Объективы мегапиксельные,Space Technology,Space Technology ST-8-3MPBL,3-мегапиксельный объектив для камер видеонаблюдения Space Technology ST-8-3MPBL. Устройство оснащено фиксированным фокусным расстоянием 8 мм.,515,img/32015.jpg
32017,Системы видеонаблюдения|IP-видеонаблюдение|Передача ip-видеосигнала по коаксиальному кабелю,Space Technology,Space Technology ST-VBT2/ST-VBR2,"Приемопередатчик (удлинитель) Space Technology ST-VBT2/ST-VBR2 предназначены для передачи сигнала Ethernet и питания 48 вольт по коаксиальному кабелю расстоянием до 2000 метров. Питание: приемник VBR2 питается от блока питания (в комплекте), передатчик VBT2 питается от приемника VBR2 по коаксиальному кабелю. Ehernet порт со скоростью 10/100 Mbps. Размеры устройства составляют: 82*100*25 мм. Рабочий диапазон температур лежит в пределах -40...+70С. В комплектации: приемопередатчики, источник питания 48 Вольт, BNC коннекторы и крепление.",7711,img/32017.jpg
32020,Системы видеонаблюдения|IP-видеонаблюдение|Передача ip-видеосигнала по коаксиальному кабелю,Space Technology,Space Technology ST-VBT20,,0,img/32020.jpg
32021,Системы видеонаблюдения|Микрофоны|Space Technology St-01 (АРУ),Space Technology,Space Technology St-01 (АРУ),"Микрофон черного цвета с автоматической регулировкой усиления Space Technology St-01 (АРУ). Аккустическая дальность до 10 метров. Отличительная особенность этого микрофона – высокая чувствительность и низкий уровень шумов встроенного усилителя, миниатюрные габариты. Встроенная АРУ позволяет передавать звуки в широком динамическом диапазоне с минимальными искажениями. Миниатюрный микрофон St-01 (АРУ) применяется в системах видеонаблюдения и охраны для аудио контроля помещений.",403,img/32021.jpg
32022,Системы видеонаблюдения|Микрофоны|Space Technology St-05 (АРУ+РР),Space Technology,Space Technology St-05 (АРУ+РР),"Микрофон желтого цвета с ручной регулировкой Space Technology St-05 (АРУ+РР). Оснащен автоматической регулировкой усиления звука. Отличительная особенность этого микрофона – высокая чувствительность и низкий уровень шумов встроенного усилителя, миниатюрные габариты. Встроенная АРУ позволяет передавать звуки в широком динамическом диапазоне с минимальными искажениями. Для более точной и оптимальной настройки уровня выходного сигнала имеется дополнительная, ручная регулировка усиления микрофона. Шлиц переменного резистора выведен на корпус микрофона. Модель St-05 (АРУ+РР) применяется в системах видеонаблюдения и охраны для аудио контроля помещений.",575,img/32022.jpg
32030,Домофонные системы|Домофоны|Видеодомофон,Space Technology,Space Technology But-1 белый,АНАЛОГ ВЗАМЕН: Space Technology But-3 белый,0,img/32030.jpg
32031,Домофонные системы|Домофоны|Видеодомофон,Space Technology,Space Technology But-1 черный,АНАЛОГ ВЗАМЕН: Space Technology But-3 черный,0,img/32031.jpg
32032,Домофонные системы|Домофоны|Видеодомофон,Space Technology,Space Technology But-2 белый,"Модель Space Technology But-2 белый представляет собой 4,3-дюймовый цветной видеодомофон (без трубки) в корпусе белого цвета. 4-х проводный, цветной видеодомофон TFT-LCD. Имеется возможность подключения до 2 внешних панелей, объединение - до 2 мониторов. Есть сенсорное управление, без трубки (Hands-free), просмотр, разговор, тревога, управление замком, A/V выход, автовключение, автовыключение. Время работы: разговор - 1 минута, вызов - 1 минута.",3990,img/32032.jpg
32033,Домофонные системы|Домофоны|Видеодомофон,Space Technology,Space Technology But-2 черный,"Модель Space Technology But-2 черный представляет собой 4,3-дюймовый цветной видеодомофон (без трубки) в корпусе черного цвета. 4-х проводный, цветной видеодомофон TFT-LCD. Имеется возможность подключения до 2 внешних панелей, объединение - до 2 мониторов. Есть сенсорное управление, без трубки (Hands-free), просмотр, разговор, тревога, управление замком, A/V выход, автовключение, автовыключение. Время работы: разговор - 1 минута, вызов - 1 минута.",2754,img/32033.jpg
32034,Домофонные системы|Домофоны|Видеодомофон,Space Technology,Space Technology But-3 белый,"Модель Space Technology But-3 белый представляет собой 9-дюймовый TFT-LCD монитор с функцией домофона (без трубки) со встроенным 4-х канальным видеорегистратором. В устройстве имеется подключение 2 вызывных панелей и 4 видеокамер, 1 микрофона. Формат сжатия сигнала H.264 с детектором движения, запись/хранение/воспроизведение - D1, работа по сети (удаленный просмотр, просмотр через телефон), CMS, ftp клиент. Модель поддерживает сенсорное управление, просмотр, разговор, управление замком, A/V выход, автовключение, автовыключение.",0,img/32034.jpg
32035,Домофонные системы|Домофоны|Видеодомофон,Space Technology,Space Technology But-3 черный,"Модель Space Technology But-3 черный представляет собой 9-дюймовый TFT-LCD монитор с функцией домофона (без трубки) со встроенным 4-х канальным видеорегистратором. В устройстве имеется подключение 2 вызывных панелей и 4 видеокамер, 1 микрофона. Формат сжатия сигнала H.264 с детектором движения, запись/хранение/воспроизведение - D1, работа по сети (удаленный просмотр, просмотр через телефон), CMS, ftp клиент. Модель поддерживает сенсорное управление, просмотр, разговор, управление замком, A/V выход, автовключение, автовыключение.",0,img/32035.jpg
32036,Домофонные системы|Домофоны|Видеодомофон,Space Technology,Space Technology St-4MT (белый),АНАЛОГ ВЗАМЕН: Space Technology But-2 белый,0,img/32036.jpg
32037,Домофонные системы|Домофоны|Видеодомофон,Space Technology,Space Technology St-4MT (черный),АНАЛОГ ВЗАМЕН: Space Technology But-2 черный,0,img/32037.jpg
32038,Домофонные системы|Домофоны|Видеодомофон,Space Technology,Space Technology Bt-1 (медь),"Space Technology Bt-1 (медь)  - панель видеодомофона цветная, антивандальная видеопанель на одного абонента, накладное исполнение на стену фирмы Space Technology. Основой устройства является матрица 1/4"" CMOS. Одна из особенностей камеры - разрешение 600 Твл. Так же следует отметить ИК подсветку - 1 м. Температура эксплуатации - -40...+50С.",3620,img/32038.jpg
32039,Домофонные системы|Домофоны|Видеодомофон,Space Technology,Space Technology Bt-1 (серый),"Space Technology Bt-1 (серый)  - панель видеодомофона цветная, антивандальная видеопанель на одного абонента, накладное исполнение на стену фирмы Space Technology. Основой устройства является матрица 1/4"" CMOS. Одна из особенностей камеры - разрешение 600 Твл. Так же следует отметить ИК подсветку - 1 м. Температура эксплуатации - -40...+50С.",3620,img/32039.jpg
32040,Домофонные системы|Домофоны|Видеодомофон,Space Technology,Space Technology Bt-2 (медь),,0,img/32040.jpg
32041,Домофонные системы|Домофоны|Видеодомофон,Space Technology,Space Technology Bt-2 (серый),,0,img/32041.jpg
32042,Домофонные системы|Домофоны|Видеодомофон,Space Technology,Space Technology Bt-5 (белая),"Space Technology Bt-5 (белая) - панель видеодомофона цветная; акриловая ударопрочная лицевая поверхность, дюралюминиевый корпус, накладное исполнение на стену фирмы Space Technology. Основой устройства является матрица 1/4"" CMOS. Одна из особенностей камеры - разрешение 700твл. Так же следует отметить ИК подсветку - 1 м. Температура эксплуатации -40...+60С.",4266,img/32042.jpg
32043,Домофонные системы|Домофоны|Видеодомофон,Space Technology,Space Technology Bt-5 (черная),АНАЛОГ ВЗАМЕН: Space Technology Bt-5 (белая),0,img/32043.jpg
32044,Источники электропитания|Источники питания до 12В|Space Technology ST-12/1А,Space Technology,Space Technology ST-12/1А,"Стабилизированный источник питания Space Technology ST-12/1А для питания аппаратуры напряжением 12В. Удобство подключения - легко снимаемая клеммная колодка, светодиодная индикация, обеспечивает электронную защиту выхода (от короткого замыкания) с восстановлением нормального режима работы после устранения причин. Максимальный ток нагрузки, А - 1; Выходное напряжение, В - 13; Ток ограничения отключения (выхода) при коротком замыкании нагрузки, А - 1,5; Допустимая температура окружающей среды составляет 0...+40°C.",408,img/32044.jpg
32045,Источники электропитания|Источники питания до 12В|Space Technology ST-12/2А,Space Technology,Space Technology ST-12/2А,"Модель стабилизированного источника питания Space Technology ST-12/2А для работы с аппаратурой напряжением 12В. Удобство подключения - легко снимаемая клеммная колодка, светодиодная индикация, обеспечивает электронную защиту выхода (от короткого замыкания) с восстановлением нормального режима работы после устранения причин. Максимальный ток нагрузки, А - 2; Выходное напряжение, В - 13; Ток ограничения отключения (выхода) при коротком замыкании нагрузки, А - 3; Допустимая температура окружающей среды составляет 0...+40°C.",712,img/32045.jpg
32046,Источники электропитания|Источники питания до 12В|Space Technology ST-12/3А,Space Technology,Space Technology ST-12/3А,"Space Technology ST-12/3А - это источник стабилизированного питания. Предназначен для питания телекоммуникационной аппаратуры стабилизированным напряжением 13В/3А. Это выбор профессионалов! Электропитание источника осуществляется от сети переменного тока напряжением 200-240 Вольт и частотой 50-60 Гц, крепеж (дюбель+шуруп) в комплекте.",1120,img/32046.jpg
32048,Системы видеонаблюдения|IP-видеонаблюдение|Оборудование POE,Space Technology,Space Technology ST-1201 POE,"Сплиттер Space Technology ST-1201 POE применяется в сетях Ethernet для разделения данных и питания, передаваемых по одному кабелю. Сплиттер PoE обеспечивает электрическим питанием сетевые устройства, не поддерживающие технологию PoЕ. Напряжение питания 48 Вольт поступает на вход в сплиттер через разъем RJ45, обеспечивает на выходе 12 Вольт.",1216,img/32048.jpg
32049,Системы видеонаблюдения|IP-видеонаблюдение|Оборудование POE,Space Technology,Space Technology ST-4801 POE,"Модель Space Technology ST-4801 POE представляет собой однопортовый инжектор PoЕ, предназначенный для подачи напряжения питания к устройствам - IP-камеры, IP-телефонии, точек досту-па беспроводных сетей, сетевых концентраторов и других устройств, к которым нежелательно или невозможно проводить отдельный электрический кабель. Инжектор предназначен для установки в закрытых помещениях. РoЕ инжектор поддерживает стандарт IEEE 802.3af и работает вместе с устрой-ствами, поддерживающими протокол IEEE 802.3af (с функцией РoЕ). Напряжение сети - 100-240V; выходное напряжение - 48 Вольт; 24 Ватт поступает на штатный разъем RJ45; макс. ток нагрузки - 0,5А; защита по току/напряжению от перегрузки - 115% - 150% от номинала; рабочая температура эксплуатации: от 0°C до 40°C.",1093,img/32049.jpg
32050,Системы видеонаблюдения|IP-видеонаблюдение|Оборудование POE,Space Technology,Space Technology ST-4804 POE,АНАЛОГ ВЗАМЕН НА ВЫБОР,0,img/32050.jpg
32051,Источники электропитания|Источники питания до 12В|Space Technology ST-DIN 12/3A,Space Technology,Space Technology ST-DIN 12/3A,АНАЛОГ ВЗАМЕН НА ВЫБОР,0,img/32051.jpg
32052,Системы видеонаблюдения|IP-видеонаблюдение|Оборудование POE,Space Technology,Space Technology ST-4816 POE,АНАЛОГ ВЗАМЕН НА ВЫБОР,0,img/32052.jpg
32053,Источники электропитания|Источники бесперебойного питания до 12В|Space Technology ST-DIN 12/3UPS,Space Technology,Space Technology ST-DIN 12/3UPS,Профессиональный стабилизированный источник питания Space Technology ST-DIN 12/3UPS с функцией подключения АКБ. Предназначен для питания телекоммуникационной аппаратуры стабилизированным напряжением 12В. Допустимая температура окружающей среды составляет -10… +45 градусов.,1605,img/32053.jpg
32054,Системы видеонаблюдения|IP-видеонаблюдение|Оборудование POE,Space Technology,Space Technology ST-4811 POE,АНАЛОГ ВЗАМЕН: Space Technology ST-4802 POE,0,img/32054.jpg
32055,Источники электропитания|Источники питания до 12В|Space Technology ST-DIN 12/5A,Space Technology,Space Technology ST-DIN 12/5A,АНАЛОГ ВЗАМЕН НА ВЫБОР,0,img/32055.jpg
32056,Источники электропитания|Источники бесперебойного питания до 12В|Space Technology SТ-12/18A (UPS),Space Technology,Space Technology SТ-12/18A (UPS),"Профессиональный стабилизированный источник питания Space Technology SТ-12/18A (UPS) с функцией подключения внешнего аккумулятора. Предназначен для питания по восемнадцати выходам видеокамер и других нагрузок с номинальным напряжением 13В и номинальным током потребления по каждому выходу до 1,0 А при работе от сети переменного тока 220В. Источник питания может применяться как резервный источник питания. Обеспечивает электронную защиту каждого выхода от перегрузки по току, в т. ч. короткого замыкания, с восстановлением нормального режима работы после устранения перегрузки, обеспечивает фильтрацию помех для устранения взаимного влияния нагрузок. Суммарный ток нагрузок по всем выходам не должен превышать, А - 18; Выходное напряжение при отсутствии напряжения сети 220 В - 10,5В...12,5В; Выходное напряжение при наличии напряжения сети 220В (от АКБ) - 13,0В; Ток ограничения выхода при коротком предохранитель отключит этот канал, А - 1,2; Напряжение отсечки АКБ от нагрузки 10,4 В; Максимальный ток заряда АКБ 2,0 А; максимально рекомендуемая емкость АКБ - 40 а/ч, допустимая температура окружающей среды - 0...+40°C. Комплектация: источник питания, крепеж, ключ замка дверцы, клеемы для АКБ, паспорт.",5550,img/32056.jpg
